CHAIN_ID,CONCEPT_NAME,CHAIN_LENGTH,GRADE_RANGE,AUTHORITY,EXAMPLE_SKILL_ID,EXAMPLE_SKILL_NAME
SB-0036,read informational texts within the atos range of 1.6 to 3.3,23,1-12,Unknown,2112f61e-e69f-e311-9503-005056801da1,Read informational texts within the ATOS range of 1.6 to 3.3
SB-0176,"compose an informative text appropriate to task, audience, and purpose in response to a prompt based",15,1-8,Pennsylvania Core Standards for English Language Arts,c8bd323b-bc82-4627-8686-1b89d537e76f,"Compose an informative text appropriate to task, audience, and purpose in response to a prompt based on first-grade reading"
SB-0187,introduce events in first-grade narrative writing,13,1-8,Pennsylvania Core Standards for English Language Arts,f72459b6-0171-421e-8965-4e69d802a7a6,Introduce events in first-grade narrative writing
SB-0159,support an opinion with a concluding statement in first-grade argumentative writing,12,1-8,Pennsylvania Core Standards for English Language Arts,c2c2e870-a0a4-4c0f-9c5d-d7f07c57b81d,Support an opinion with a concluding statement in first-grade argumentative writing
SB-0191,use dialogue to develop experiences and show character responses in third-grade narrative writing,11,3-8,Pennsylvania Core Standards for English Language Arts,f885ab4a-5f74-4d5b-8f91-b2ecfd898313,Use dialogue to develop experiences and show character responses in third-grade narrative writing
SB-0040,"read regularly and independently in second-appropriate texts for sustained periods of time, increasi",11,2-12,Unknown,e08e5fa0-530f-41c1-b7ee-4063873ae571,"Read regularly and independently in second-grade-appropriate texts for sustained periods of time, increasing speed, stamina, and comprehension"
SB-0190,use sensory details to convey experiences and events in fourth-grade narrative writing,9,4-8,Pennsylvania Core Standards for English Language Arts,4f8ad72a-2b93-4726-8cd8-9872b84f4428,Use sensory details to convey experiences and events in fourth-grade narrative writing
SB-0044,use evidence from a literary or informational text in writing to support analysis and reflection in ,9,4-12,Unknown,d508bf13-b703-41cc-887a-ba622fd910e6,Use evidence from a literary or informational text in writing to support analysis and reflection in response to 4th-grade reading
SB-0164,support a topic with a concluding statement in first-grade informative writing,7,1-8,Pennsylvania Core Standards for English Language Arts,afd9508f-1b58-4135-813d-ffa3c554c16a,Support a topic with a concluding statement in first-grade informative writing
SB-0162,compose an argumentative text in response to a prompt based on second-grade reading using characteri,7,2-8,Pennsylvania Core Standards for English Language Arts,70ab7b11-1119-4b39-9326-21bd8a961245,Compose an argumentative text in response to a prompt based on second-grade reading using characteristics of genre and craft
SB-0186,use transitions to signal time shifts in sixth-grade narrative writing,7,6-8,Pennsylvania Core Standards for English Language Arts,d22105d8-7771-403b-b75b-f948862228c9,Use transitions to signal time shifts in sixth-grade narrative writing
SB-0062,determine or clarify the meaning of homographs in a second-grade text,7,2-5,Unknown,0bd15b5e-478a-4e0a-a7db-418dd58617ac,Determine or clarify the meaning of homographs in a second-grade text
SB-0090,"spell multisyllabic words with vce syllable patterns (e.g., became)",7,2-5,Unknown,70e54663-32e8-422f-a8a1-af220f67564b,"Spell multisyllabic words with VCe syllable patterns (e.g., became)"
SB-0203,revise third-grade writing to achieve an intended effect,6,3-8,Pennsylvania Core Standards for English Language Arts,a77c38e6-256c-4939-a6b1-311122b020f2,Revise third-grade writing to achieve an intended effect
SB-0188,establish a setting and situation in third-grade narrative writing,6,3-8,Pennsylvania Core Standards for English Language Arts,a58d8eec-544b-44dd-bfed-2ec194ca85f8,Establish a setting and situation in third-grade narrative writing
SB-0201,strengthen third-grade writing by revising direct quotations,6,3-8,Pennsylvania Core Standards for English Language Arts,add24371-4acf-40a3-b751-e9dd1674c1ab,Strengthen third-grade writing by revising direct quotations
SB-0074,read on-level texts aloud at the estimated oral reading fluency (orf) to meet first-grade benchmarks,5,1-5,Unknown,f90ff61e-e69f-e311-9503-005056801da1,Read on-level texts aloud at the estimated oral reading fluency (ORF) to meet first-grade benchmarks
SB-0071,"correctly form printed letters developing appropriate letter, word, and sentence spacing",5,1-5,Unknown,5cc49789-7b9d-41c3-9a3a-87b5fb83d938,"Correctly form printed letters developing appropriate letter, word, and sentence spacing"
SB-0088,demonstrate and apply spelling knowledge by spelling common letter/sound correlations,5,K-2,Unknown,b0a9e359-77ab-49f5-aaa1-023d2ad5d2db,Demonstrate and apply spelling knowledge by spelling common letter/sound correlations
SB-0156,"develop a topic by including related facts, concrete details, quotations, examples, and other inform",5,4-8,Pennsylvania Core Standards for English Language Arts,3dfe2dda-e2f2-41d6-abef-6d5838466682,"Develop a topic by including related facts, concrete details, quotations, examples, and other information in fourth-grade informative writing"
SB-0012,compose an argumentative text in response to a prompt based on first-grade reading using characteris,5,1-12,Unknown,b41d6e61-9794-4ecd-9bfc-0464a35473db,Compose an argumentative text in response to a prompt based on first-grade reading using characteristics of genre and craft
SB-0192,use transitional words and phrases to sequence events in fourth-grade narrative writing,5,4-8,Pennsylvania Core Standards for English Language Arts,325d3c32-7dac-47a4-b7fe-9dc00d8aa3e2,Use transitional words and phrases to sequence events in fourth-grade narrative writing
SB-0047,cite the strongest textual evidence to support analysis of an informational text,5,8-10,Unknown,4c11f61e-e69f-e311-9503-005056801da1,Cite the strongest textual evidence to support analysis of an informational text
SB-0193,provide a sense of closure in second-grade narrative writing,4,2-7,Pennsylvania Core Standards for English Language Arts,92d7d03c-e87d-40ce-b421-6ef7ebb2f035,Provide a sense of closure in second-grade narrative writing
SB-0183,support a topic with a concluding statement in second-grade informative writing,4,2-8,Pennsylvania Core Standards for English Language Arts,1683e172-8801-42c2-99c7-1a222a7a642e,Support a topic with a concluding statement in second-grade informative writing
SB-0045,cite textual evidence to support analysis of an informational text,4,6-8,Unknown,4211f61e-e69f-e311-9503-005056801da1,Cite textual evidence to support analysis of an informational text
SB-0049,"ask literal, interpretive, and, with support, evaluative questions of text",4,3-6,Unknown,9e2870c3-da67-4882-a384-106563137fea,"Ask literal, interpretive, and, with support, evaluative questions of text"
SB-0050,"compose an informative text appropriate to task, audience, and purpose in response to a prompt based",4,9-12,Unknown,31808ea3-0122-47c3-a194-636ef3be905c,"Compose an informative text appropriate to task, audience, and purpose in response to a prompt based on ninth-grade reading"
SB-0200,revise fifth-grade writing to maintain consistency in style and tone,4,5-8,Pennsylvania Core Standards for English Language Arts,b62d60d6-3590-47d0-aff6-ca1672f54d2f,Revise fifth-grade writing to maintain consistency in style and tone
SB-0064,use homophones accurately based on second-grade reading and content,4,2-5,Unknown,ac897f55-d5e0-43f3-b26d-6204a84296bf,Use homophones accurately based on second-grade reading and content
SB-0096,demonstrate and apply spelling knowledge by spelling multisyllabic words,4,2-5,Unknown,e980279d-8393-4ff5-8b72-31d856b1441b,Demonstrate and apply spelling knowledge by spelling multisyllabic words
SB-0219,"revise second-grade writing for errors of punctuation, spelling, capitalization, or grammar",4,2-8,Hawai'i Common Core Standards for English Language Arts,48c6bcbc-65a3-4897-a7b6-1de21c2c2490,"Revise second-grade writing for errors of punctuation, spelling, capitalization, or grammar"
SB-0163,group related ideas persuasively in fourth-grade argumentative writing,4,4-6,Pennsylvania Core Standards for English Language Arts,849bf28a-b790-4db3-9d95-7a6d0f9bc326,Group related ideas persuasively in fourth-grade argumentative writing
SB-0208,analyze how texts from various academic disciplines organize information and treat domain-specific v,4,9-12,Hawai'i Common Core Standards for English Language Arts,f02050f5-6f44-4fdb-bcea-7f699718abf5,Analyze how texts from various academic disciplines organize information and treat domain-specific vocabulary
SB-0212,engage in whole- and small-group guided reading of second-appropriate texts to practice reading stra,4,2-5,Hawai'i Common Core Standards for English Language Arts,dfc50ee3-a6af-4eb7-b231-1577c05efedd,Engage in whole- and small-group guided reading of second-grade-appropriate texts to practice reading strategies
SB-0092,"spell multisyllabic words with final stable syllables (e.g., candle)",4,3-5,Unknown,e0324832-fe9f-4613-8adb-cea263666c28,"Spell multisyllabic words with final stable syllables (e.g., candle)"
SB-0170,provide a concluding statement or section in fifth-grade informative writing,4,5-8,Pennsylvania Core Standards for English Language Arts,7d178c90-7258-49aa-975a-238e38ceecfb,Provide a concluding statement or section in fifth-grade informative writing
SB-0122,"ask and answer questions to clarify the meanings of words when listening to literary texts, and appl",3,K-1,Unknown,6a10f61e-e69f-e311-9503-005056801da1,"Ask and answer questions to clarify the meanings of words when listening to literary texts, and apply foundational skills and strategies when encounte"
SB-0134,"identify and use homographs/multiple-meaning words (e.g., <i>amo</i> (verb) and <i>amo</i> (owner) a",3,2-3,Illinois Learning Standards for Spanish Language Arts,64d02960-1112-47a6-b174-aac028848b51,"Identify and use homographs/multiple-meaning words (e.g., <i>amo</i> (verb) and <i>amo</i> (owner) and determine their meanings in grade-appropriate t"
SB-0144,regularly engage in independent and group reading of increasingly complex related texts on topics of,3,10-12,Minnesota K-12 Academic Standards in English Language Arts,61da0a5d-1f65-41f7-af2d-c04158189a5e,"Regularly engage in independent and group reading of increasingly complex related texts on topics of study, expanding vocabulary and knowledge to be u"
SB-0109,describe how the structural elements of a story contribute to its meaning in a fourth-grade literary,3,4-5,Unknown,b82473dc-0414-4949-820b-ebf9871b13e2,Describe how the structural elements of a story contribute to its meaning in a fourth-grade literary text
SB-0104,"accurately read unfamiliar appropriate multisyllabic words in isolation, using knowledge of word mor",3,4-5,Unknown,ef0ff61e-e69f-e311-9503-005056801da1,"Accurately read unfamiliar grade-appropriate multisyllabic words in isolation, using knowledge of word morphology (e.g., autograph, construction)"
SB-0101,"recognize and understand appropriate contractions (e.g., i'm, isn't)",3,1-3,Unknown,9d460a45-06ce-44da-87d6-fcf672f03801,"Recognize and understand grade-appropriate contractions (e.g., I'm, isn't)"
SB-0172,use coordinating conjunctions,3,3-4,Pennsylvania Core Standards for English Language Arts,0de1cd87-1b90-4c62-b460-9c4c73e05f60,Use coordinating conjunctions
SB-0152,apply knowledge of parts of speech to determine the meanings of words and phrases in appropriate tex,3,6-8,Georgia K-12 English Language Arts Standards,8149f26f-f8a0-4c18-a397-f057fa5d5a8b,"Apply knowledge of parts of speech to determine the meanings of words and phrases in grade-appropriate texts (e.g., understand a word is a descriptive"
SB-0155,use linking words and phrases to connect opinions and reasons in third-grade argumentative writing,3,3-5,Pennsylvania Core Standards for English Language Arts,c41b3bb4-d94c-451f-9c12-346f67dc91de,Use linking words and phrases to connect opinions and reasons in third-grade argumentative writing
SB-0095,"spell single-syllable words with vowel teams, including digraphs and diphthongs (e.g., soap, meat, t",3,2-5,Unknown,ec83beca-dd30-4d3f-8b67-2eecace2c74d,"Spell single-syllable words with vowel teams, including digraphs and diphthongs (e.g., soap, meat, toy)"
SB-0158,provide an introductory paragraph that provides relevant context to the argument in fifth-grade argu,3,5-6,Pennsylvania Core Standards for English Language Arts,704bfc6c-6b95-496e-8e25-25c618cdc268,Provide an introductory paragraph that provides relevant context to the argument in fifth-grade argumentative writing
SB-0068,identify the cultural perspective reflected in a work of literature from outside the united states,3,9-10,Unknown,a710f61e-e69f-e311-9503-005056801da1,Identify the cultural perspective reflected in a work of literature from outside the United States
SB-0161,establish and maintain a formal style in seventh-grade argumentative writing,3,7-8,Pennsylvania Core Standards for English Language Arts,d22d6ef4-806e-4ad1-a6ba-2b91f3d4956b,Establish and maintain a formal style in seventh-grade argumentative writing
SB-0174,capitalize dates,3,1-2,Pennsylvania Core Standards for English Language Arts,09acb3d5-27c6-40b1-ad99-cdb1d64ab81a,Capitalize dates
SB-0165,identify the performance task of a second-grade argumentative writing prompt,3,2-5,Pennsylvania Core Standards for English Language Arts,17d19019-cb20-43f4-93fb-16d1fa694b2c,Identify the performance task of a second-grade argumentative writing prompt
SB-0113,accurately read unfamiliar appropriate multisyllabic words in isolation using knowledge of all lette,3,4-5,Unknown,ed0ff61e-e69f-e311-9503-005056801da1,"Accurately read unfamiliar grade-appropriate multisyllabic words in isolation using knowledge of all letter-sound correspondences (e.g., other, beagle"
SB-0053,"read level high-frequency words with automaticity (e.g., complete, notice, travel)",3,3-5,Unknown,a6453225-39f8-4847-8df2-52f4b86c0a7f,"Read grade-level high-frequency words with automaticity (e.g., complete, notice, travel)"
SB-0195,use reflexive pronouns,3,2-6,Pennsylvania Core Standards for English Language Arts,a601a2c8-5f69-467d-98be-a21d52edebd2,Use reflexive pronouns
SB-0004,analyze informational texts on topics related to diverse cultures and viewpoints,3,9-11,Unknown,585f73bc-70bc-4955-9c9c-f59ade0ae2b3,Analyze informational texts on topics related to diverse cultures and viewpoints
SB-0005,compare and contrast the most important points presented in informational texts on the same topic,3,2-4,Unknown,d911f61e-e69f-e311-9503-005056801da1,Compare and contrast the most important points presented in informational texts on the same topic
SB-0218,"spell appropriate words with double-letter endings (e.g., pass, full)",3,1-4,Hawai'i Common Core Standards for English Language Arts,1bc2d44d-79b2-4d71-a647-f5d4bba6e75a,"Spell grade-appropriate words with double-letter endings (e.g., pass, full)"
SB-0013,support claims with logical reasoning in seventh-grade argumentative writing,3,7-8,Unknown,e4c377d0-31e6-42c0-a007-4d57612a2f4c,Support claims with logical reasoning in seventh-grade argumentative writing
SB-0189,organize an event sequence logically in third-grade narrative writing,3,3-5,Pennsylvania Core Standards for English Language Arts,4deafde7-00eb-4e99-a079-52602e61d33c,Organize an event sequence logically in third-grade narrative writing
SB-0018,distinguish between print and pictures,3,K-7,Unknown,1ea10be3-5322-479a-905a-26b536ec6c58,Distinguish between print and pictures
SB-0209,"read a wide range of nonfiction, with a wide coverage of topics, historical periods, forms, and auth",3,6-8,Hawai'i Common Core Standards for English Language Arts,5b40c225-3800-e411-9e54-005056801da1,"Read a wide range of nonfiction, with a wide coverage of topics, historical periods, forms, and authors, including high-quality works (e.g., biographi"
SB-0205,introduce the topic of a text in argumentative writing,3,K-1,Hawai'i Common Core Standards for English Language Arts,dadb0b37-b1f1-4c0c-815e-d8a02e32a34d,Introduce the topic of a text in Kindergarten argumentative writing
SB-0031,"use sentence-level context clues (e.g., embedded word definitions, restatement) to determine or clar",3,3-5,Unknown,6a12f61e-e69f-e311-9503-005056801da1,"Use sentence-level context clues (e.g., embedded word definitions, restatement) to determine or clarify the meanings of general academic and content-a"
SB-0127,"use knowledge of a variety of word relationships (e.g., synonyms, antonyms; superordinate and subord",3,10-12,Unknown,b012f61e-e69f-e311-9503-005056801da1,"Use knowledge of a variety of word relationships (e.g., synonyms, antonyms; superordinate and subordinate) in analogies in order to infer the meanings"
SB-0042,"understand the meanings of idioms (e.g., come out in the wash) in appropriate prose and poetry and a",3,10-12,Unknown,e6314c9c-a69f-e311-9503-005056801da1,"Understand the meanings of idioms (e.g., come out in the wash) in grade-appropriate prose and poetry and analyze an author's use of idiomatic expressi"
SB-0051,"read level irregularly spelled sight words automatically (e.g., certain, notice)",3,3-5,Unknown,e90ff61e-e69f-e311-9503-005056801da1,"Read grade-level irregularly spelled sight words automatically (e.g., certain, notice)"
SB-0194,use temporal words to signal the order of events in first-grade narrative writing,3,1-3,Pennsylvania Core Standards for English Language Arts,c1d97f7b-684f-4921-91f3-9f7ff30279f4,Use temporal words to signal the order of events in first-grade narrative writing
SB-0178,develop a topic by using credible supporting evidence in seventh-grade informative writing,2,7-8,Pennsylvania Core Standards for English Language Arts,268fe892-a52f-4245-98e2-bb9a4c782628,Develop a topic by using credible supporting evidence in seventh-grade informative writing
SB-0185,use linking words and phrases to connect ideas within categories of information in fourth-grade info,2,4-5,Pennsylvania Core Standards for English Language Arts,76dd7fb0-4894-44d8-a5a2-7582e06c314e,Use linking words and phrases to connect ideas within categories of information in fourth-grade informative writing
SB-0184,use precise language and domain-specific vocabulary in seventh-grade informative writing,2,7-8,Pennsylvania Core Standards for English Language Arts,0da21023-5b65-4563-affe-febd7ebf44fc,Use precise language and domain-specific vocabulary in seventh-grade informative writing
SB-0220,explain the function of interjections in a sentence,2,5-6,Oklahoma Academic Standards for English Language Arts,18f92508-6a5d-4e7a-ab0a-ad13778824ed,Explain the function of interjections in a sentence
SB-0151,determine how texts from various academic disciplines organize information and treat domain-specific,2,7-8,Georgia K-12 English Language Arts Standards,89086154-a011-4879-a7d0-a4e4a4964fec,Determine how texts from various academic disciplines organize information and treat domain-specific vocabulary
SB-0150,analyze how the author’s use of sentence structure and syntax affects the target audience and suppor,2,10-11,Georgia K-12 English Language Arts Standards,fb3d286b-c50c-4ef2-ad99-8b9a015a64ae,Analyze how the author’s use of sentence structure and syntax affects the target audience and supports the text’s purpose
SB-0221,recognize and correct inappropriate shifts in pronoun number and person,2,6-8,Oklahoma Academic Standards for English Language Arts,edc3ea55-7f9a-45d4-9d63-e487f1443b78,Recognize and correct inappropriate shifts in pronoun number and person
SB-0149,"spell appropriate multisyllabic words with multiple sound-spelling patterns (e.g., behave, unlock, n",2,2-3,Indiana Academic Standards for English/Language Arts,03b4fd0e-58a0-48a5-b317-bcce99c9926b,"Spell grade-appropriate multisyllabic words with multiple sound-spelling patterns (e.g., behave, unlock, number)"
SB-0148,listen to a wide range of contemporary and classic poetry and stories that are at a level beyond whi,2,1-2,North Dakota English Language Arts Content Standards,f43fc225-3800-e411-9e54-005056801da1,"Listen to a wide range of contemporary and classic poetry and stories that are at a level beyond which could be read independently (e.g., chapter book"
SB-0147,listen to and comprehend a wide range of appropriate nonfiction and literary text as well as texts t,2,4-5,North Dakota English Language Arts Content Standards,42ba593d-0738-410f-acb7-d618fb272a73,Listen to and comprehend a wide range of grade-appropriate nonfiction and literary text as well as texts that are at a level beyond which could be rea
SB-0146,"listen to a wide range of nonfiction, including reference books and textbooks, that is at a level be",2,2-3,North Dakota English Language Arts Content Standards,f63fc225-3800-e411-9e54-005056801da1,"Listen to a wide range of nonfiction, including reference books and textbooks, that is at a level beyond which could be read independently"
SB-0222,"revise third-grade writing for errors of punctuation, spelling, capitalization, or grammar",2,3-5,Oklahoma Academic Standards for English Language Arts,280e2b4b-738c-4652-920d-7c179e45cd66,"Revise third-grade writing for errors of punctuation, spelling, capitalization, or grammar"
SB-0145,"analyze how authors from various contexts (e.g., diverse, intersectional, multicultural) use their o",2,11-12,North Dakota English Language Arts Content Standards,9e17f254-50be-421e-9c40-5804aacdc12b,"Analyze how authors from various contexts (e.g., diverse, intersectional, multicultural) use their own perspective and purpose to shape various texts "
SB-0143,"use appropriate general academic and content-area vocabulary correctly in context, expanding vocabul",2,7-8,Illinois Learning Standards for Spanish Language Arts,ee7b9822-bfc2-4426-a2ab-1ebd5f0d0057,"Use grade-appropriate general academic and content-area vocabulary correctly in context, expanding vocabulary to include words or phrases of particula"
SB-0154,"read a wide variety of complex appropriate text aloud with accuracy, automaticity, and full comprehe",2,11-12,English Standards of Learning for Virginia Public Schools,78624c0a-7fda-4a65-acfa-25f5c082a353,"Read a wide variety of complex grade-appropriate text aloud with accuracy, automaticity, and full comprehension, automatically adjusting reading rate,"
SB-0142,analyze and explain the importance of subtle differences in meaning between appropriate synonyms (e.,2,9-10,Illinois Learning Standards for Spanish Language Arts,6cbcc385-245d-4563-a772-5e9f329063e6,"Analyze and explain the importance of subtle differences in meaning between grade-appropriate synonyms (e.g., réplica y reproducción) in context"
SB-0141,count the number of syllables in fourth-grade level words,2,4-5,Illinois Learning Standards for Spanish Language Arts,bb5fca20-e6a8-4711-8897-baf88e1594ff,Count the number of syllables in fourth-grade level words
SB-0140,accurately read unfamiliar appropriate multisyllabic words in isolation using knowledge of all lette,2,4-5,Illinois Learning Standards for Spanish Language Arts,7149b9e0-6b30-4309-8cee-8800f1200b3b,"Accurately read unfamiliar grade-appropriate multisyllabic words in isolation using knowledge of all letter-sound correspondences (e.g., septiembre, l"
SB-0139,accurately read unfamiliar appropriate multisyllabic words in context using knowledge of all letter-,2,4-5,Illinois Learning Standards for Spanish Language Arts,466419fc-94ad-45c8-b47f-37ab8bc2b7a1,"Accurately read unfamiliar grade-appropriate multisyllabic words in context using knowledge of all letter-sound correspondences (e.g., El <i>dinosauri"
SB-0138,"correctly place the written accent on the vowel on which the tonic accent falls in hiatus (e.g., <i>",2,4-5,Illinois Learning Standards for Spanish Language Arts,bf1f9892-f3c3-4bc9-be6f-0bec161de581,"Correctly place the written accent on the vowel on which the tonic accent falls in hiatus (e.g., <i>hacía, baúl, raíz</i>)"
SB-0137,demonstrate and apply spelling knowledge by marking accents appropriately when conjugating three app,2,3-5,Illinois Learning Standards for Spanish Language Arts,d684fcf4-0745-4cef-98a5-503d0840552d,"Demonstrate and apply spelling knowledge by marking accents appropriately when conjugating grade-three appropriate verbs (e.g., simple and imperfect p"
SB-0136,demonstrate and apply spelling knowledge by spelling <i>palabras esdrújulas</i> (words with the stre,2,3-5,Illinois Learning Standards for Spanish Language Arts,72272d29-9b51-4b4a-836e-26f3c51a768a,Demonstrate and apply spelling knowledge by spelling <i>palabras esdrújulas</i> (words with the stress on the antepenultimate syllable) that always ha
SB-0135,"recognize that a written accent (spelling accent) is a mark, called a tilde, placed above a vowel, a",2,K-1,Illinois Learning Standards for Spanish Language Arts,f8ae63ab-787d-425b-b021-d223f0157bbc,"Recognize that a written accent (spelling accent) is a mark, called a tilde, placed above a vowel, and that the marked syllable is emphasized in pronu"
SB-0223,"decode and encode appropriate words with special letter combinations (e.g., <i>q</i> is always used ",2,K-1,South Carolina College- and Career-Ready Standards English Language Arts,887b50f1-5d04-40da-831a-d4c3871b0451,"Decode and encode grade-appropriate words with special letter combinations (e.g., <i>q</i> is always used with <i>u</i>)"
SB-0133,"determine the meanings of homophones (e.g., hola and ola) in appropriate texts using sentence contex",2,1-2,Illinois Learning Standards for Spanish Language Arts,07ea9a65-8a2e-4af9-a396-abe370a103f7,"Determine the meanings of homophones (e.g., hola and ola) in grade-appropriate texts using sentence context or prior knowledge of spellings"
