CHAIN_ID,CONCEPT_NAME,CHAIN_LENGTH,GRADE_RANGE,AUTHORITY,EXAMPLE_SKILL_ID,EXAMPLE_SKILL_NAME
SB-0115,"identify and understand synonyms for appropriate words (e.g., aid/help, describe/explain)",2,5-8,Unknown,bb314c9c-a69f-e311-9503-005056801da1,"Identify and understand synonyms for grade-appropriate words (e.g., aid/help, describe/explain)"
SB-0100,use knowledge of second-grade prefixes and base words to predict the meanings of unfamiliar words,2,2-4,Unknown,c348d1e0-b8d1-4654-b811-9b06ac73accc,Use knowledge of second-grade prefixes and base words to predict the meanings of unfamiliar words
SB-0116,analyze and explain the importance of subtle differences in meaning between appropriate synonyms (e.,2,9-10,Unknown,aa12f61e-e69f-e311-9503-005056801da1,"Analyze and explain the importance of subtle differences in meaning between grade-appropriate synonyms (e.g., replica/reproduction) in context"
SB-0117,"read and interpret texts in print and digital formats that employ varying styles, fonts, graphics, a",2,3-4,Unknown,1d9099c3-ac98-49e1-bab8-d95c89830ff7,"Read and interpret texts in print and digital formats that employ varying styles, fonts, graphics, and symbols"
SB-0118,"locate information in simple graphical text features (e.g., illustrations, maps, timelines, tables, ",2,4-5,Unknown,49324c9c-a69f-e311-9503-005056801da1,"Locate information in simple graphical text features (e.g., illustrations, maps, timelines, tables, charts)"
SB-0119,analyze the controlling idea of a poem and how it is elaborated,2,9-10,Unknown,6c334c9c-a69f-e311-9503-005056801da1,Analyze the controlling idea of a poem and how it is elaborated
SB-0120,expand knowledge of general academic and content-area vocabulary independently and apply this knowle,2,11-12,Unknown,ba12f61e-e69f-e311-9503-005056801da1,"Expand knowledge of general academic and content-area vocabulary independently and apply this knowledge correctly when reading, writing, speaking, and"
SB-0121,"use appropriate general academic and content-area vocabulary correctly in context, expanding vocabul",2,7-8,Unknown,9212f61e-e69f-e311-9503-005056801da1,"Use grade-appropriate general academic and content-area vocabulary correctly in context, expanding vocabulary to include words or phrases of particula"
SB-0123,determine or clarify the pronunciations and precise meanings of key words and phrases by consulting ,2,4-5,Unknown,6f12f61e-e69f-e311-9503-005056801da1,Determine or clarify the pronunciations and precise meanings of key words and phrases by consulting reference materials such as print or online dictio
SB-0124,alphabetize words to the first or second letter,2,1-2,Unknown,34894a01-a0d3-4064-8524-1a2bdacc433b,Alphabetize words to the first or second letter
SB-0125,efficiently use a range of strategies to determine or clarify the precise meanings of general academ,2,7-8,Unknown,9f11f61e-e69f-e311-9503-005056801da1,Efficiently use a range of strategies to determine or clarify the precise meanings of general academic and content-area words and phrases in grade-app
SB-0102,"use knowledge of simple affixes (e.g., un-, re-, over-, -er, -est) and familiar base words to decode",2,2-3,Unknown,5f12f61e-e69f-e311-9503-005056801da1,"Use knowledge of simple affixes (e.g., un-, re-, over-, -er, -est) and familiar base words to decode and predict the meanings of new words"
SB-0099,"spell words using knowledge of syllable division patterns (e.g., pillow, chicken, believe, farmer)",2,2-4,Unknown,68e6a632-d1cc-4d0e-bbd6-2ab192277eba,"Spell words using knowledge of syllable division patterns (e.g., pillow, chicken, believe, farmer)"
SB-0070,describe how the narrator's first-person point of view influences a second-grade literary text,2,2-3,Unknown,96b07d15-b9ce-4a4e-88bb-9a6865aec68c,Describe how the narrator's first-person point of view influences a second-grade literary text
SB-0082,demonstrate responsible and ethical use of information and communication technologies by knowing the,2,11-12,Unknown,c7ebd7b1-49a0-47fd-98d0-2d8d01f5d1aa,Demonstrate responsible and ethical use of information and communication technologies by knowing the kinds of information that should not be publicly 
SB-0072,read and appreciate english literature by rereading literature and other writing,2,9-10,Unknown,6b40c225-3800-e411-9e54-005056801da1,Read and appreciate English literature by rereading literature and other writing
SB-0073,establish purpose for reading and apply an understanding of that purpose to guide focus while readin,2,7-8,Unknown,31045263-b897-41eb-abb5-e07b3359f4f8,Establish purpose for reading and apply an understanding of that purpose to guide focus while reading a grade-appropriate text
SB-0075,"adjust reading pace, expression, and phrasing when reading level texts aloud based on reading purpos",2,7-8,Unknown,b5ee2b1c-e430-4394-a995-6119bf2bd21f,"Adjust reading pace, expression, and phrasing when reading grade-level texts aloud based on reading purpose and the nature of the text"
SB-0076,"reread, with increased fluency and confidence, familiar books that consist of words with taught grap",2,K-1,Unknown,4f40c225-3800-e411-9e54-005056801da1,"Reread, with increased fluency and confidence, familiar books that consist of words with taught grapheme-phoneme correspondences, including regular an"
SB-0077,"identify and read appropriate abbreviations (e.g., dr., ave.)",2,3-4,Unknown,b44eb4e5-9f15-42f6-8698-ea3b38dc4e40,"Identify and read grade-appropriate abbreviations (e.g., Dr., Ave.)"
SB-0078,select from a wide range of note-taking strategies to choose the most useful note form for the purpo,2,9-10,Unknown,c640c225-3800-e411-9e54-005056801da1,Select from a wide range of note-taking strategies to choose the most useful note form for the purpose
SB-0079,use different techniques to aid understanding and to locate information in a text quickly and accura,2,4-6,Unknown,3441c225-3800-e411-9e54-005056801da1,"Use different techniques to aid understanding and to locate information in a text quickly and accurately (e.g., skimming, scanning, and close reading)"
SB-0080,"begin to evaluate informational texts, deciding on value, quality, or usefulness (e.g., looking for ",2,7-8,Unknown,a53dc225-3800-e411-9e54-005056801da1,"Begin to evaluate informational texts, deciding on value, quality, or usefulness (e.g., looking for possible bias and comparing different sources on t"
SB-0081,"develop an understanding of people, cultures, and societies and explore self-identity through litera",2,4-5,Unknown,08f72be3-35f5-4a20-86ed-6eb90cf45075,"Develop an understanding of people, cultures, and societies and explore self-identity through literature, media, and oral tradition"
SB-0083,"show familiarity with age-appropriate language for the discussion of fiction (e.g., author, characte",2,K-2,Unknown,d840c225-3800-e411-9e54-005056801da1,"Show familiarity with age-appropriate language for the discussion of fiction (e.g., author, character)"
SB-0098,demonstrate and apply spelling knowledge by marking accents appropriately when conjugating four appr,2,4-6,Unknown,63a96d40-9f08-4558-b2d2-eba757e6dd34,"Demonstrate and apply spelling knowledge by marking accents appropriately when conjugating grade-four appropriate verbs (e.g., simple and imperfect pa"
SB-0084,"with prompting and support, sequence events from an informational text (e.g., retell events in order",2,K-1,Unknown,0c11f61e-e69f-e311-9503-005056801da1,"With prompting and support, sequence events from an informational text (e.g., retell events in order, draw pictures)"
SB-0085,demonstrate and apply spelling knowledge by spelling words accurately that contain <i>sílabas trabad,2,3-6,Unknown,e4eb3855-044f-4161-a1b3-6402feced6d0,Demonstrate and apply spelling knowledge by spelling words accurately that contain <i>sílabas trabadas</i>
SB-0086,"spell appropriate words using knowledge of suffixes and how base words can change, such as dropping ",2,4-5,Unknown,8f4197e1-df40-41cd-923a-18487e3698df,"Spell grade-appropriate words using knowledge of suffixes and how base words can change, such as dropping e, changing y to i, and doubling final conso"
SB-0087,"spell appropriate words with digraphs or trigraphs (e.g., think, high, catch, store)",2,1-2,Unknown,5e83a8ff-5849-4094-a8d3-efb1e90bdac9,"Spell grade-appropriate words with digraphs or trigraphs (e.g., think, high, catch, store)"
SB-0089,"demonstrate and apply spelling knowledge by spelling words with common syllabic patterns (e.g., cv, ",2,K-1,Unknown,26bf7d86-541c-4992-8abb-5d5cef8f27ad,"Demonstrate and apply spelling knowledge by spelling words with common syllabic patterns (e.g., CV, VC, CCV, CVC, VCV, CVCV, CCVCV, and CVCCV)"
SB-0091,"demonstrate and apply spelling knowledge by spelling words with silent ""h"" and words that use the sy",2,2-3,Unknown,3a871895-d41e-4188-a2fc-51bb5b33917b,"Demonstrate and apply spelling knowledge by spelling words with silent ""h"" and words that use the syllables <i>que-, qui-, gue-, gui-, güe-</i>, and <"
SB-0093,"spell multisyllabic words with closed syllable patterns including complex closed syllables (e.g., ad",2,4-5,Unknown,07eabc8f-af5f-4118-87ac-aec92cd0b554,"Spell multisyllabic words with closed syllable patterns including complex closed syllables (e.g., adjust)"
SB-0094,demonstrate and apply spelling knowledge by spelling words with diphthongs and hiatus,2,2-5,Unknown,1e649ec3-976b-4a4f-a835-c93add993f43,Demonstrate and apply spelling knowledge by spelling words with diphthongs and hiatus
SB-0097,"spell appropriate words using knowledge of prefixes (e.g., reread, misunderstand, undone)",2,3-4,Unknown,de137ea5-0c51-4d76-b76c-79e4f2c9b787,"Spell grade-appropriate words using knowledge of prefixes (e.g., reread, misunderstand, undone)"
SB-0224,use knowledge of all letter-sound correspondences and syllabication patterns to accurately read unfa,2,7-8,West Virginia College- and Career-Readiness Standards for English Language Arts,5480e567-f642-4f75-98a1-6aaaf7215ac7,"Use knowledge of all letter-sound correspondences and syllabication patterns to accurately read unfamiliar multisyllabic words in context (e.g., tempe"
