Strand,Pillar,Domain,Skill Area,Skill Set,Skill Subset,Skill Subset Annotation
Language Comprehension,Vocabulary Knowledge,Word Learning Strategies,Use of Reference Materials,Advanced Resource Utilization,Evaluating Source Reliability,"The ability to assess the credibility and reliability of different reference sources, like academic versus user-edited dictionaries."
Language Comprehension,Vocabulary Knowledge,Word Learning Strategies,Use of Reference Materials,Advanced Resource Utilization,Integrating Data from Multiple Sources,"The skill of combining information from various reference materials to gain a comprehensive understanding of words. For example: Combining definitions, synonyms, and usage from dictionary, thesaurus, and language apps to understand a word fully."
Language Comprehension,Vocabulary Knowledge,Word Learning Strategies,Use of Reference Materials,Cross-Linguistic Influence,Identifying False Cognates,"The skill of recognizing words that look similar in two languages but have different meanings (e.g., 'actual' in English means real, whereas 'actual' in Spanish means current)."
Language Comprehension,Vocabulary Knowledge,Word Learning Strategies,Use of Reference Materials,Cross-Linguistic Influence,Recognizing Cognates,"The ability to recognize words in different languages that have a common etymological origin (e.g., 'information' in English and 'información' in Spanish)."
Language Comprehension,Vocabulary Knowledge,Word Learning Strategies,Use of Reference Materials,Using Dictionaries and Thesauruses,Finding Synonyms and Antonyms,"The ability to use thesauruses and dictionaries to locate synonyms and antonyms for given words, like 'large.'"
Language Comprehension,Vocabulary Knowledge,Word Learning Strategies,Use of Reference Materials,Using Dictionaries and Thesauruses,Looking Up Definitions,The skill of using dictionaries to find and understand word definitions. For example: Using a dictionary to find that 'ephemeral' means short-lived.
Language Comprehension,Vocabulary Knowledge,Word Learning Strategies,Use of Reference Materials,Utilizing Online Resources,Navigating Online Dictionaries,"The skill of effectively using online dictionary resources to find word meanings and other information, like Merriam-Webster to find meanings of words."
Language Comprehension,Vocabulary Knowledge,Word Learning Strategies,Use of Reference Materials,Utilizing Online Resources,Using Language Apps,"The ability to employ language learning applications to enhance vocabulary knowledge, like Duolingo to enhance vocabulary knowledge."
Language Expression,Oral Discourse,Advanced Collaborative Strategies,Collaborative Discussion,Incorporating Multiple Perspectives,Incorporating Multiple Perspectives (standard update),"The ability to integrate and consider multiple viewpoints within a discussion, like acknowledging diverse opinions."
Language Expression,Oral Discourse,Advanced Collaborative Strategies,Collaborative Discussion,In-depth Cooperative Strategies,In-depth Cooperative Strategies (standard update),"The skill of using advanced collaboration techniques to enhance group discussions and ensure effective cooperation, such as rotating roles."
Language Expression,Oral Discourse,Advanced Collaborative Strategies,Collaborative Discussion,Understanding Inter-Speaker Dynamics,Understanding Inter-Speaker Dynamics (standard update),"The knowledge of the dynamics between speakers in a group discussion and the ability to navigate them effectively, such as managing differing communication styles."
Language Expression,Oral Discourse,Advanced Collaborative Strategies,Presentation Techniques,Advanced Presentation Nuances,Advanced Presentation Nuances (standard update),"The skill of applying advanced presentation techniques to enhance delivery and engagement, like using multimedia elements effectively."
Language Expression,Oral Discourse,Advanced Collaborative Strategies,Presentation Techniques,Specificity in Presentation Skills,Specificity in Presentation Skills (standard update),"The ability to tailor presentation skills according to the specific context and audience, such as customizing language and content."
Language Expression,Oral Discourse,Advanced Collaborative Strategies,Rhetorical Logic,Combining Information From Various Formats,Combining Information From Various Formats (standard update),"The knowledge of synthesizing information from multiple sources, such as text, visuals, and verbal inputs, to construct coherent arguments, such as text, visuals, and verbal inputs, to construct coherent arguments."
Language Expression,Oral Discourse,Argumentation and Debate,Constructing and Defending Arguments,Construct and Defend Claims,Construct and Defend Claims,"The ability to formulate clear claims, support with evidence, and defend positions in discussion."
Language Expression,Oral Discourse,Argumentation and Debate,Counterargument and Rebuttal,Develop Counterarguments and Rebuttals,Develop Counterarguments and Rebuttals,The ability to identify opposing views and craft effective rebuttals.
Language Expression,Oral Discourse,Argumentation and Debate,Cross-examination,Ask Probing Questions,Ask Probing Questions,"The ability to question assumptions, seek clarification, and reveal weaknesses in opposing arguments."
Language Expression,Oral Discourse,Discussion and Collaboration,Analyzing Speaker,Evaluating Speaker Claims,Assessing Credibility,"The capability to gauge the overall credibility of the speaker based on their arguments, evidence, and presentation, such as determining the trustworthiness of a speaker in a courtroom."
Language Expression,Oral Discourse,Discussion and Collaboration,Analyzing Speaker,Evaluating Speaker Claims,Assessing Credibility Of Claims,"The skill of evaluating the reliability and truthfulness of a speaker's claims, such as fact-checking arguments in a political speech."
Language Expression,Oral Discourse,Discussion and Collaboration,Analyzing Speaker,Evaluating Speaker Claims,Identifying Speaker's Claims,"The ability to recognize and articulate the main points and assertions made by a speaker, such as identifying key points in a TED Talk."
Language Expression,Oral Discourse,Discussion and Collaboration,Analyzing Speaker,Evaluating Speaker Rhetoric,Analyzing Rhetorical Devices,"The knowledge of identifying and understanding the rhetorical devices employed by a speaker to persuade or inform, like metaphors and similes in a motivational speech."
Language Expression,Oral Discourse,Discussion and Collaboration,Analyzing Speaker,Evaluating Speaker Rhetoric,Assessing Effectiveness Of Rhetoric,"The skill of evaluating how effectively a speaker uses rhetorical strategies to achieve their purpose, such as the use of pathos in a persuasive advertisement."
Language Expression,Oral Discourse,Discussion and Collaboration,Analyzing Speaker,Evaluating Speaker Rhetoric,Identifying Rhetorical Strategies,"The ability to recognize the rhetorical tactics a speaker uses within their discourse, such as in a campaign speech."
Language Expression,Oral Discourse,Discussion and Collaboration,Collaborative Discussion,Finding Common Ground,Recognizing Mutual Interests,"The ability to identify shared goals or points of agreement among discussion participants, such as finding common interests in a community forum."
Language Expression,Oral Discourse,Discussion and Collaboration,Collaborative Discussion,Posing Questions,Formulating Relevant Questions,"The skill of creating pertinent and thoughtful questions that advance the discussion, such as asking about the implications of a new policy in a town hall meeting."
Language Expression,Oral Discourse,Discussion and Collaboration,Collaborative Discussion,Posing Questions,Using Open-ended Questions,"The ability to formulate open-ended questions that encourage expansive discussion and critical thinking, such as asking ""What are the potential benefits of this proposal?""."
Language Expression,Oral Discourse,Discussion and Collaboration,Collaborative Discussion,Responding To Questions,Clarifying And Elaborating Responses,"The skill of expanding on initial answers to provide further detail and clarity, such as elaborating on project details in a team meeting."
Language Expression,Oral Discourse,Discussion and Collaboration,Collaborative Discussion,Responding To Questions,Providing Thoughtful Answers,"The capability to offer clear and insightful responses to questions posed by others during a discussion, such as explaining the rationale behind a business decision."
Language Expression,Oral Discourse,Discussion and Collaboration,Facilitation Skills,Facilitating Discussion,Ensuring Fairness,"The knowledge of managing discussions to ensure all participants have an equal opportunity to contribute, such as balancing speaking time during a group discussion."
Language Expression,Oral Discourse,Discussion and Collaboration,Paraphrasing Information,Paraphrasing Oral Info,Extracting Key Points,"The skill of summarizing the main ideas and points from spoken information, such as highlighting key points in a debate."
Language Expression,Oral Discourse,Discussion and Collaboration,Paraphrasing Information,Paraphrasing Oral Info,Identifying Key Information,"The skill of recognizing and extracting the most important information from spoken discourse, such as taking notes during a lecture."
Language Expression,Oral Discourse,Discussion and Collaboration,Paraphrasing Information,Paraphrasing Oral Info,Rephrasing Without Changing Meaning,"The ability to restate information in one's own words while maintaining the original meaning, like summarizing a colleague's report in a meeting."
Language Expression,Oral Discourse,Discussion and Collaboration,Paraphrasing Information,Summarizing Discussions,Capturing Main Points,"The ability to succinctly convey the primary messages and conclusions of a discussion, like summarizing a conference call."
Language Expression,Oral Discourse,Discussion and Collaboration,Paraphrasing Information,Summarizing Discussions,Creating Concise Summaries,"The skill of producing brief, clear summaries of discussions or oral presentations, such as summarizing a workshop."
Language Expression,Oral Discourse,Discussion and Collaboration,Paraphrasing Information,Summarizing Discussions,Highlighting Main Points,"The ability to draw attention to the key ideas and conclusions reached during a discussion, like summarizing meeting outcomes."
Language Expression,Oral Discourse,Argumentation and Debate,Argumentation,Constructing Arguments,Argument Support,"The ability to support arguments with appropriate evidence and logical reasoning, like providing data and examples in a research presentation."
Language Expression,Oral Discourse,Argumentation and Debate,Argumentation,Constructing Arguments,Developing Persuasive Arguments,"The skill of creating arguments that effectively persuade the audience through logical, emotional, and ethical appeals, as seen in persuasive essays."
Language Expression,Oral Discourse,Argumentation and Debate,Argumentation,Constructing Arguments,Formulating Clear Arguments,"The skill of developing and presenting clear, logical, and coherent arguments, such as creating a structured argument in a debate."
Language Expression,Oral Discourse,Argumentation and Debate,Argumentation,Delivering Constructive Criticism,Giving Actionable Feedback,"The skill of providing feedback that includes practical steps for improvement, like suggesting changes to strengthen an argument."
Language Expression,Oral Discourse,Argumentation and Debate,Argumentation,Delivering Constructive Criticism,Giving Constructive Suggestions,"The ability to offer helpful, specific suggestions for improvement, such as giving feedback on a project proposal."
Language Expression,Oral Discourse,Argumentation and Debate,Argumentation,Delivering Constructive Criticism,Monitoring Receiver's Response,"The ability to observe and analyze how feedback is received and understood, such as reading body language and asking follow-up questions."
Language Expression,Oral Discourse,Argumentation and Debate,Argumentation,Delivering Constructive Criticism,Using the Sandwich Method,"The knowledge of delivering feedback by starting with positive comments, addressing areas for improvement, and concluding with positive reinforcement, like in performance reviews."
Language Expression,Oral Discourse,Argumentation and Debate,Argumentation,Developing Counterarguments,Constructing Rebuttals,"The skill of developing responses to counter opposing arguments effectively, like refuting points during a political debate."
Language Expression,Oral Discourse,Argumentation and Debate,Argumentation,Developing Counterarguments,Identifying Opposing Views,"The ability to recognize and understand opposing viewpoints on an issue, such as acknowledging counterarguments in a policy debate."
Language Expression,Oral Discourse,Argumentation and Debate,Cross-examination,Clarifying Arguments,Asking For Clarification,"The skill of seeking additional information or clarification to better understand an argument, such as asking for examples or evidence during a discussion."
Language Expression,Oral Discourse,Argumentation and Debate,Cross-examination,Clarifying Arguments,Highlighting Ambiguities,"The ability to identify and point out unclear or ambiguous aspects of an argument, such as questioning vagueness in a proposal."
Language Expression,Oral Discourse,Argumentation and Debate,Cross-examination,Questioning Opponents,Challenging Opponent’s Viewpoint,"The ability to question and critique the viewpoints presented by opponents, such as highlighting weaknesses in a rival’s argument."
Language Expression,Oral Discourse,Argumentation and Debate,Cross-examination,Questioning Opponents,Crafting Insightful Questions,"The skill of formulating thought-provoking questions that challenge an opponent’s argument, such as during a formal debate."
Language Expression,Oral Discourse,Argumentation and Debate,Cross-examination,Questioning Opponents,Critical Questioning Techniques,"The skill of applying various questioning techniques to critically analyze an opponent's stance, such as using Socratic questioning."
Language Expression,Oral Discourse,Argumentation and Debate,Facilitation Skills,Keeping Time,Ensuring Equal Speaking Time,"The knowledge of managing time effectively to ensure all participants have equal opportunities to speak, such as timing contributions in a group discussion."
Language Expression,Oral Discourse,Argumentation and Debate,Rebuttal,Defending Position,Reinforcing Your Argument,"The skill of reaffirming and strengthening one's own argument during a discussion or debate, such as restating key points with additional evidence."
Language Expression,Oral Discourse,Argumentation and Debate,Rebuttal,Defending Position,Using Evidence To Defend Position,"The ability to use credible evidence to support and defend a position, such as citing studies and statistics in a policy argument."
Language Expression,Oral Discourse,Argumentation and Debate,Rebuttal,Formulating Rebuttals,Constructing Persuasive Responses,"The ability to develop convincing rebuttals to counter opposing views, such as crafting responses in a structured debate."
Language Expression,Oral Discourse,Argumentation and Debate,Rebuttal,Formulating Rebuttals,Countering Opposing Views,"The skill of effectively disputing and refuting opposing arguments, such as answering criticisms in a public forum."
Language Expression,Oral Discourse,Argumentation and Debate,Rebuttal,Formulating Rebuttals,Identifying Weak Points,"The skill of identifying vulnerabilities or weaknesses in opposing arguments, such as pinpointing logical flaws."
Language Expression,Oral Discourse,Delivery Techniques,"Body, Eye, and Voice",Use Effective Delivery Techniques,Use Effective Delivery Techniques,"The ability to use body language, eye contact, pacing, pausing, and vocal variety to enhance clarity and engagement."
Language Expression,Oral Discourse,Delivery Techniques,Body Language,Effective Gestures And Postures,Maintaining Confident Posture,"The skill of adopting a confident and open posture to convey authority and credibility, such as standing tall during a presentation."
Language Expression,Oral Discourse,Delivery Techniques,Body Language,Effective Gestures And Postures,Using Natural Gestures,"The ability to use gestures naturally and appropriately to enhance communication, like gesturing to emphasize points in a speech."
Language Expression,Oral Discourse,Delivery Techniques,Body Language,Effective Hand Gestures,Using Hand Movements for Emphasis,"The knowledge of using hand movements purposefully to emphasize key points, such as highlighting important data in a lecture."
Language Expression,Oral Discourse,Delivery Techniques,Body Language,Using Open Body Language,Avoiding Closed Postures,"The ability to adopt open and receptive body language to engage with the audience, such as avoiding crossing arms."
Language Expression,Oral Discourse,Delivery Techniques,Body Language,Using Open Body Language,Engaging With Open Gestures,"The skill of using open gestures to create a welcoming and engaging presence, like using expansive hand movements."
Language Expression,Oral Discourse,Delivery Techniques,Eye Contact,Establishing Connection With Audience,Creating Personal Connection,"The ability to use eye contact to establish a personal connection with the audience, such as looking directly at individuals."
Language Expression,Oral Discourse,Delivery Techniques,Eye Contact,Establishing Connection With Audience,Using Eye Contact To Build Rapport,"The skill of using eye contact strategically to build rapport and trust with the audience, such as maintaining steady eye contact."
Language Expression,Oral Discourse,Delivery Techniques,Eye Contact,Maintaining Audience Engagement,Making Eye Contact,"The ability to maintain eye contact with the audience to keep them engaged, like looking at different sections of the audience."
Language Expression,Oral Discourse,Delivery Techniques,Eye Contact,Maintaining Audience Engagement,Rotating Gaze Across Audience,"The skill of moving gaze across the audience to ensure all areas feel included and engaged, like scanning the room during a speech."
Language Expression,Oral Discourse,Delivery Techniques,Eye Contact,Maintaining Engagement,Establishing Connection With Audience,"The ability to use eye contact consistently to keep the audience engaged and connected, like making periodic eye contact."
Language Expression,Oral Discourse,Delivery Techniques,Vocal Variety,Modulating Voice,Adjusting Pitch And Tone,"The skill of varying pitch and tone to maintain audience interest and emphasize key points, like using a deeper tone for seriousness."
Language Expression,Oral Discourse,Delivery Techniques,Vocal Variety,Modulating Voice,Varying Speed And Volume,"The ability to adjust speaking speed and volume to enhance the delivery and keep the audience engaged, like speaking faster for excitement."
Language Expression,Oral Discourse,Delivery Techniques,Vocal Variety,Voice Modulation,Pausing For Effect,"The ability to use pauses strategically to enhance the impact of the message, like pausing before delivering the punchline."
Language Expression,Oral Discourse,Delivery Techniques,Vocal Variety,Voice Modulation,Stressing Important Words,"The skill of emphasizing important words through changes in pitch, volume, or tone, such as raising volume for key terms."
Language Expression,Oral Discourse,Discussion and Collaboration,Facilitation and Turn-taking,Facilitate Equitable Participation,Facilitate Equitable Participation,"The ability to manage turn-taking, summarize points, and ensure inclusive, goal-directed discussions."
Language Expression,Oral Discourse,Discussion and Collaboration,Questioning and Responding,Ask and Respond to Questions,Ask and Respond to Questions,"The ability to pose relevant questions and provide clear, constructive responses to advance discussion."
Language Expression,Oral Discourse,Effective Presentation,Contextual Adaptation,Adapting To Audience,Adjusting Tone And Style,"The ability to modify tone and presentation style to suit the audience, such as using more formal language for professional presentations."
Language Expression,Oral Discourse,Effective Presentation,Contextual Adaptation,Adapting To Audience,Modifying Content For Relevance,"The skill of tailoring presentation content to ensure it is relevant to the audience's interests and needs, like including industry-specific examples."
Language Expression,Oral Discourse,Effective Presentation,Contextual Adaptation,Applying Audience Feedback,Gathering Feedback,"The knowledge of collecting feedback from the audience to improve future presentations, such as using surveys or comment forms."
Language Expression,Oral Discourse,Effective Presentation,Contextual Adaptation,Applying Audience Feedback,Implementing Feedback In Presentation,"The ability to incorporate audience feedback to enhance the effectiveness of presentations, like adjusting content based on suggestions."
Language Expression,Oral Discourse,Effective Presentation,Contextual Adaptation,Understanding Audience,Adapting Content,"The skill of customizing presentation content based on audience analysis and feedback, such as emphasizing certain points."
Language Expression,Oral Discourse,Effective Presentation,Contextual Adaptation,Understanding Audience,Identifying Audience Needs,"The ability to ascertain the audience’s needs and expectations to ensure the presentation meets them, like incorporating relevant topics."
Language Expression,Oral Discourse,Effective Presentation,Contextual Adaptation,Understanding Audience,Researching Audience Demographics,"The skill of gathering information about the audience to tailor the presentation accordingly, such as understanding the audience's background and interests."
Language Expression,Oral Discourse,Effective Presentation,Multimedia Integration,Integrating Visual Aids,Enhancing Presentation With Visuals,"The ability to use visual aids to make presentations more engaging and understandable, like adding infographics."
Language Expression,Oral Discourse,Effective Presentation,Multimedia Integration,Integrating Visual Aids,Enhancing Understanding,"The skill of using visuals to clarify complex information and improve audience comprehension, such as illustrating concepts with diagrams."
Language Expression,Oral Discourse,Effective Presentation,Multimedia Integration,Integrating Visual Aids,Selecting Appropriate Visuals,"The knowledge of choosing suitable visual aids to complement and enhance the presentation content, like using charts and graphs."
Language Expression,Oral Discourse,Effective Presentation,Multimedia Integration,Using Multimedia In Presentations,Incorporating Visuals And Graphics,"The ability to integrate various multimedia elements, such as pictures and graphics, to support the presentation, like embedding videos."
Language Expression,Oral Discourse,Effective Presentation,Multimedia Integration,Using Multimedia In Presentations,Using Multimedia Software,"The knowledge of employing multimedia software to create and deliver dynamic presentations, such as using PowerPoint or Prezi."
Language Expression,Oral Discourse,Effective Presentation,Organized Presentation,Organizing Presentation,Creating Effective Outlines,"The ability to develop comprehensive outlines to guide the presentation, such as detailing main points and subpoints."
Language Expression,Oral Discourse,Effective Presentation,Organized Presentation,Organizing Presentation,Structuring Content Logically,"The skill of arranging presentation content in a logical order to ensure clarity and flow, like creating a structured outline."
Language Expression,Oral Discourse,Effective Presentation,Organized Presentation,Structuring Main Points,Developing Clear Main Points,"The skill of identifying and emphasizing primary points within a presentation, like focusing on key arguments."
Language Expression,Oral Discourse,Effective Presentation,Organized Presentation,Structuring Main Points,Developing Logical Flow,"The skill of ensuring a coherent and logical progression of ideas throughout the presentation, like organizing points sequentially."
Language Expression,Oral Discourse,Effective Presentation,Organized Presentation,Structuring Main Points,Using Logical Transitions,"The ability to use transitions to maintain the logical flow of the presentation, like connecting ideas smoothly."
Language Expression,Oral Discourse,Effective Presentation,Organized Presentation,Using Transitions,Maintaining Audience Engagement,"The ability to use effective transitions to keep the audience engaged and focused, like summarizing points before moving on."
Language Expression,Oral Discourse,Effective Presentation,Presentation Techniques,Design Principles,Creating Visual Appeal,"The ability to apply design principles to create visually appealing presentations, like using color schemes and layout effectively."
Language Expression,Oral Discourse,Effective Presentation,Presentation Techniques,Responding To Questions,Providing Clear Answers,"The skill of answering audience questions clearly and effectively, such as clarifying points made during a presentation."
Language Expression,Oral Discourse,Listening,Active and Critical Listening,Apply Active Listening Behaviors,Apply Active Listening Behaviors,"The ability to attend, paraphrase, and provide feedback that demonstrates understanding."
Language Expression,Oral Discourse,Listening,Active and Critical Listening,Evaluate Messages Critically,Evaluate Messages Critically,"The ability to evaluate credibility, logic, and relevance of spoken information."
