Strand,Pillar,Domain,Skill Area,Skill Set,Skill Subset,Skill Subset Annotation
Active Self-Regulation,Executive Function Skills,Core Executive Processes,Cognitive Flexibility,Contextual Strategy Selection,,"Examples: Match Strategies to Text Demands — The ability to match and switch strategies (decoding, prediction, summarizing) to the demands of the text.; Match Strategy to Text Feature — The ability to match strategies to specific text features.; Switch on Comprehension Signals — The ability to switch strategies based on comprehension signals."
Active Self-Regulation,Executive Function Skills,Core Executive Processes,Cognitive Flexibility,Set Shifting Across Tasks,,"Examples: Shift Between Rules and Criteria — The ability to shift between rules/criteria as task demands change (e.g., genre vs. purpose).; Alternate Rule Sets Efficiently — The ability to alternate between rule sets efficiently without loss.; Recover from Shift Costs — The ability to minimize performance drop during/after shifts."
Active Self-Regulation,Executive Function Skills,Core Executive Processes,Cognitive Flexibility,Strategy Shifting,,"Examples: Switching Strategies Based on Task Demands — The ability to shift between strategies (e.g., decoding vs. context use) and task sets as demands change.; Shift Between Decoding and Contextual Inference — The ability to alternate focus between phonics-based decoding and contextual inference as text demands change.; Adjust Strategy by Genre and Purpose — The ability to adjust strategy selection based on genre conventions and reading purpose (study vs. skim)."
Active Self-Regulation,Executive Function Skills,Core Executive Processes,Emotion Regulation,Emotion Regulation Strategies,,Examples: Breathing and Cognitive Reappraisal — The ability to apply breathing and cognitive reappraisal to regulate affect during challenging reading.; Breathing Protocols for Reading — The ability to apply brief breathing protocols to regulate arousal.; Cognitive Reappraisal Script — The ability to apply a personal reappraisal script during difficulty.
Active Self-Regulation,Executive Function Skills,Core Executive Processes,Emotion Regulation,Managing Reading-related Frustration,,Examples: Regulating Emotions to Sustain Engagement — The ability to manage frustration/anxiety to persist through challenging texts.; Use Cognitive Reappraisal During Difficulty — The ability to reinterpret difficulty as growth to reduce frustration.; Apply Brief Reset Routines — The ability to use brief breathing/movement resets to restore engagement.
Active Self-Regulation,Executive Function Skills,Core Executive Processes,Emotion Regulation,Persistence Strategies,,Examples: Use Positive Self-talk and Goal Reminders — The ability to use positive self-talk and goal reminders to persist through difficulty.; Positive Self‑talk Prompts — The ability to use scripted prompts to persist.; Goal Reminder Cues — The ability to use reminders (visual/verbal) to maintain effort.
Active Self-Regulation,Executive Function Skills,Core Executive Processes,Inhibitory Control,Delay and Self-control,,"Examples: Delay Prepotent Responses — The ability to delay prepotent responses (e.g., checking phone) to maintain task goals.; Delay Discounting Control — The ability to resist preference for immediate distractions.; Implement Delay Timers — The ability to use timers to enforce short delays before breaks."
Active Self-Regulation,Executive Function Skills,Core Executive Processes,Inhibitory Control,Distraction Resistance,,Examples: Suppressing Irrelevant Responses — The ability to inhibit impulses and resist distractors while reading to maintain task goals.; Ignore Irrelevant Stimuli — The ability to suppress attention capture from irrelevant sounds and visuals.; Suspend Impulsive Checking — The ability to delay checking devices or unrelated resources until task checkpoints.
Active Self-Regulation,Executive Function Skills,Core Executive Processes,Inhibitory Control,Selective Attention Control,,Examples: Filter Irrelevant Stimuli — The ability to filter irrelevant stimuli and maintain task focus amidst competing inputs.; Filter Visual Distractors — The ability to filter visual distractors while scanning lines.; Filter Auditory Distractors — The ability to filter auditory distractors while reading.
Active Self-Regulation,Executive Function Skills,Core Executive Processes,Planning and Organization,Prioritization and Sequencing,,Examples: Prioritize and Sequence Tasks — The ability to prioritize reading tasks and sequence steps to meet deadlines.; Order Tasks by Importance/Deadline — The ability to order tasks by priority and deadline.; Sequence Steps Logically — The ability to sequence steps to reduce context switching.
Active Self-Regulation,Executive Function Skills,Core Executive Processes,Planning and Organization,Task Planning,,"Examples: Planning Steps for Complex Reading Tasks — The ability to plan, sequence, and organize steps to complete complex reading assignments.; Create Stepwise Reading Plan — The ability to outline steps for complex reading assignments.; Set Time Blocks and Breaks — The ability to allocate focused time blocks and restorative breaks."
Active Self-Regulation,Executive Function Skills,Core Executive Processes,Planning and Organization,Time Allocation Planning,,Examples: Allocate Time to Subtasks — The ability to allocate time appropriately across reading subtasks.; Estimate Task Durations — The ability to estimate durations accurately for subtasks.; Plan Buffer Time — The ability to plan buffer time for unexpected difficulties.
Active Self-Regulation,Executive Function Skills,Core Executive Processes,Working Memory Updating,Goal and Information Updating,,Examples: Maintaining and updating task goals and textual information during reading — The ability to hold and update relevant information in mind while integrating new text.; Refresh Key Points During Reading — The ability to mentally refresh key ideas at planned intervals.; Revise Task Goals as New Info Emerges — The ability to update goals based on evolving understanding.
Active Self-Regulation,Executive Function Skills,Core Executive Processes,Working Memory Updating,Rehearsal and Refresh,,Examples: Rehearse and Refresh Information — The ability to rehearse and refresh relevant information in working memory during reading.; Articulatory Rehearsal — The ability to use subvocal rehearsal to maintain items.; Refresh in N‑back Window — The ability to refresh items within a limited n‑back span.
Active Self-Regulation,Executive Function Skills,Core Executive Processes,Working Memory Updating,Relevance Updating,,Examples: Update Relevance Filters During Reading — The ability to update what information is relevant as new text is encountered.; Promote Relevant Info — The ability to promote newly relevant info into focus.; Demote Irrelevant Info — The ability to demote no‑longer‑relevant info from focus.
Active Self-Regulation,Executive Function Skills,Maintaining Focus,Attention Control,Attention and Focus,,Examples: Establishing a Focus Ritual — The practice of creating and consistently following a set of actions or behaviors designed to prepare the mind and body for focused work or study.; Managing Distractions — The skill of identifying and minimizing potential distractions to maintain focus while reading. Example: Turning off notifications on electronic devices and choosing a quiet place to read.; Mindfulness Before Reading — The practice of engaging in mindfulness activities before reading to prepare mentally. Example: Taking a few deep breaths and visualizing a calm scenario to clear the mind before starting to read.
Active Self-Regulation,Executive Function Skills,Maintaining Focus,Attention Control,Focus Routines,,Examples: Establish Rituals and Cues — The ability to establish and use rituals/cues to enter and maintain a focused state.; Cue‑Controlled Start Routine — The ability to use consistent cues to begin focused work.; Environmental Refocus Cues — The ability to use environmental cues to restore focus after drift.
Active Self-Regulation,Executive Function Skills,Maintaining Focus,Attention-Sustaining Techniques,Avoiding Multitasking,,Examples: Focused Reading Sessions — The ability to concentrate on one reading task at a time without multitasking. Example: Reading a chapter of a book without checking phone notifications or engaging in other activities.; Single-Task Techniques — The method of focusing on a single task at hand to enhance productivity and reduce cognitive load. Example: Completing reading assignments without switching between different tasks to improve comprehension.
Active Self-Regulation,Executive Function Skills,Maintaining Focus,Attention-Sustaining Techniques,Time Management,,Examples: Creating Reading Schedules — The skill of developing and adhering to a consistent reading schedule to ensure regular practice. Example: Allocating a specific time each day for reading and sticking to that routine.; Using Timers for Reading Sessions — The practice of using timers to set specific reading periods and breaks to enhance focus. Example: Setting a timer for 25 minutes of focused reading followed by a 5-minute break (Pomodoro Technique).
Active Self-Regulation,Executive Function Skills,Using Working Memory,Information Retention Strategies,Chunking Information,,"Examples: Breaking Down Text into Chunks — The practice of dividing text into smaller, more manageable sections to improve memory retention.; Categorizing Information — The skill of grouping related information together to enhance understanding and recall."
Active Self-Regulation,Executive Function Skills,Using Working Memory,Information Retention Strategies,Use of Mnemonics,,"Examples: Applying Acronyms and Acrostics — The practice of creating and using acronyms and acrostics to remember complex information.; Creating Mnemonic Devices — The ability to use mnemonic techniques, such as acronyms or rhymes, to aid in memorizing information."
Active Self-Regulation,Executive Function Skills,Using Working Memory,Recalling Text,Enhancing Memory,,Examples: Text Summarization — Summarizing passages to reinforce understanding and memory.; Visualization Techniques — Using mental imagery to remember and understand text.
Active Self-Regulation,Executive Function Skills,Using Working Memory,Recalling Text,Retrieval Practice,,Examples: Self-Quiz Key Points — The ability to self-quiz key points from the text to strengthen retrieval.; Immediate and Delayed Recall — The ability to perform immediate and delayed recall cycles.; Generate Self‑questions for Retrieval — The ability to generate self‑questions to drive retrieval.
Active Self-Regulation,Motivation and Engagement,Expectation of Value,Building Reading Identity,Extrinsic vs. Intrinsic Motivation,,"Examples: Balancing External Rewards and Internal Satisfaction — The practice of finding a balance between external incentives and intrinsic enjoyment to sustain long-term reading motivation.; Identifying Personal Motivators — The ability to discern personal motivations for reading, whether they be external rewards or internal satisfaction."
Active Self-Regulation,Motivation and Engagement,Expectation of Value,Building Reading Identity,Reader Self-efficacy,,Examples: Strengthen Reader Self-efficacy — The ability to strengthen beliefs about one's capability to succeed as a reader.; Rates of Confidence by Task — The ability to rate confidence for upcoming reading tasks.; Link Confidence to Strategies — The ability to link confidence estimates to strategy choice.
Active Self-Regulation,Motivation and Engagement,Expectation of Value,Building Reading Identity,Self-Perception as a Reader,,Examples: Reflecting on Reading Identity — The practice of contemplating one's own identity as a reader and understanding personal reading habits and preferences.; Articulate Reader Strengths and Needs — The ability to identify personal reading strengths and growth areas.; Set Identity‑Aligned Intentions — The ability to set intentions that reinforce desired reader identity.
Active Self-Regulation,Motivation and Engagement,Expectation of Value,Valuing Reading,Developing Value,,Examples: Sharing Personal Stories — Discussing personal positive experiences with reading to highlight its value.; Understanding Benefits — Recognizing the cognitive and emotional benefits of reading.
Active Self-Regulation,Motivation and Engagement,Expectation of Value,Valuing Reading,Encouragement,,Examples: Celebrating Small Wins — Acknowledging and celebrating minor reading achievements to build motivation.; Engaging with Role Models — Learning about and from reading role models.
Active Self-Regulation,Motivation and Engagement,Reading Challenges and Goals,Celebrating Achievements,Recognition and Sharing,,"Examples: Share Achievements and Recognitions — The ability to share achievements appropriately (class, peers, family) to reinforce motivation.; Document Achievements — The ability to document achievements with brief evidence.; Share Summaries with Peers — The ability to share brief summaries/insights with peers/family."
Active Self-Regulation,Motivation and Engagement,Reading Challenges and Goals,Celebrating Achievements,Social Sharing,,Examples: Participating in Reading Challenges and Competitions — The ability to engage in and benefit from reading challenges and competitive reading events.; Sharing Achievements with Peers — The skill of communicating reading milestones and accomplishments with friends and peers.
Active Self-Regulation,Motivation and Engagement,Reading Challenges and Goals,Goal Setting,Adjusting Goals,,Examples: Adjust Goals Based on Progress — The ability to adjust goals based on progress monitoring and feedback.; Tighten/Loosen Criteria — The ability to tighten/loosen criteria based on progress.; Revise Goal Scope — The ability to revise scope (breadth/depth) of goals.
Active Self-Regulation,Motivation and Engagement,Reading Challenges and Goals,Goal Setting,Goal Creation,,"Examples: Setting Reading Targets — The ability to set specific, measurable reading goals to achieve over a set period.; Define SMART Reading Goals — The ability to create specific, measurable, achievable, relevant, time‑bound goals.; Align Goals to Text Difficulty — The ability to calibrate goals to text complexity and stamina."
Active Self-Regulation,Motivation and Engagement,Reading Challenges and Goals,Goal Setting,Milestone Setting,,Examples: Set Intermediate Milestones — The ability to set intermediate milestones that scaffold toward larger reading goals.; Define Intermediate Milestones — The ability to define granular milestones within the goal.; Schedule Milestone Reviews — The ability to schedule reviews at each milestone.
Active Self-Regulation,Motivation and Engagement,Reading Challenges and Goals,Goal Setting,Progress Tracking and Reflection,,"Examples: Maintaining a Reading Journal — The ability to document reading experiences, goals, and reflections in a journal to monitor progress and support motivation.; Update Progress Indicators — The ability to maintain checklists/meters of progress.; Write Session Reflections — The ability to write brief reflections after sessions to inform next steps."
Active Self-Regulation,Motivation and Engagement,Reading Challenges and Goals,Goal Setting,Task Management,,"Examples: Breakdown of Goals into Manageable Tasks — The skill of dividing reading goals into smaller, manageable tasks for easier accomplishment.; Reflecting on Goal Achievement and Challenges — The practice of reviewing and reflecting on the attainment of reading goals and any obstacles encountered.; Using Reading Logs — The ability to maintain a record of reading activities and progress through reading logs."
Active Self-Regulation,Motivation and Engagement,Reading Challenges and Goals,Overcoming Reading Obstacles,Barrier Identification,,Examples: Identifying and Addressing Barriers — The skill of recognizing challenges that hinder reading progress and finding solutions to overcome them.; Log Barriers and Triggers — The ability to record obstacles with contextual triggers.; Prioritize Barriers to Address — The ability to prioritize obstacles by impact and fixability.
Active Self-Regulation,Motivation and Engagement,Reading Challenges and Goals,Overcoming Reading Obstacles,Strategy Development,,Examples: Developing Strategies for Progress — The ability to create and implement strategies for maintaining steady reading growth.; Plan Strategy Trials — The ability to plan trials of alternative strategies for obstacles.; Analyze Strategy Effectiveness — The ability to analyze outcomes to keep/modify/replace strategies.
Active Self-Regulation,Motivation and Engagement,Reading Challenges and Goals,Overcoming Reading Obstacles,Strategy Experimentation,,Examples: Test and Select Strategies — The ability to test multiple strategies and select those that improve progress.; AB Test Strategies — The ability to AB test two strategies on comparable tasks.; Maintain Strategy Log — The ability to maintain a log of tried strategies and outcomes.
Active Self-Regulation,Motivation and Engagement,Reading Challenges and Goals,Reading Habits,Developing Reading Stamina,,Examples: Building Concentration — The skill of improving focus and concentration to sustain longer periods of reading.; Increasing Reading Time — The ability to gradually extend reading periods to build reading endurance.
Active Self-Regulation,Motivation and Engagement,Reading Challenges and Goals,Reading Habits,Integrating Reading into Daily Life,,Examples: Following a Reading Timetable — The ability to schedule regular reading sessions as part of a daily routine.; Reflective Reading — The practice of pausing during and after reading to reflect on the content and personal reactions to it.
Active Self-Regulation,Motivation and Engagement,Reading Challenges and Goals,Sustaining Motivation,Goal-linked Incentives,,Examples: Link Rewards to Goal Milestones — The ability to link meaningful incentives to goal milestones to sustain motivation.; Define Meaningful Rewards — The ability to define rewards that are personally meaningful.; Schedule Incentive Checkpoints — The ability to schedule checkpoints for earned incentives.
Active Self-Regulation,Motivation and Engagement,Reading Challenges and Goals,Sustaining Motivation,Incentive Creation,,Examples: Setting Reading Goals and Rewards — The skill of establishing specific reading targets and using rewards to maintain motivation.; Tracking Progress and Celebrating Achievements — The ability to monitor reading progress and celebrate milestones to stay motivated.
Active Self-Regulation,Motivation and Engagement,Reading Interest-based Choice,Making Informed Choices,Exploring New Genres and Authors,,"Examples: Exploring New Genres and Authors — The ability to venture into new literary genres and discover works by different authors to diversify the reading experience.; List Genres to Sample — The ability to plan a sampling list of new genres/subgenres.; Track Newly Liked Authors — The ability to maintain a record of newly discovered, preferred authors."
Active Self-Regulation,Motivation and Engagement,Reading Interest-based Choice,Making Informed Choices,Reflecting on Reading Preferences,,"Examples: Reflecting on Reading Preferences — The practice of analyzing and understanding one's reading preferences to guide future selections.; Record Preference Patterns — The ability to record patterns in preferred topics, styles, and formats.; Update Preference Profile — The ability to periodically update a personal preference profile."
Active Self-Regulation,Motivation and Engagement,Reading Interest-based Choice,Managing Personal Reading Library,Cataloging Books,,"Examples: Cataloging Books — The practice of keeping a detailed record of books in a personal library, including read and unread titles, and adding notes or summaries.; Record Book Metadata — The ability to record title, author, genre, tags, and status.; Capture Notes and Summaries — The ability to capture brief notes/summaries for later retrieval."
Active Self-Regulation,Motivation and Engagement,Reading Interest-based Choice,Managing Personal Reading Library,Organizing a Personal Library,,Examples: Organizing a Personal Library — The skill of arranging and maintaining a personal collection of books for easy access and retrieval.; Shelve by Genre/Series/Purpose — The ability to organize physical/digital shelves by useful categories.; Maintain a To‑Read Queue — The ability to maintain and reorder a prioritized to‑read list.
Active Self-Regulation,Motivation and Engagement,Reading Interest-based Choice,Reader's Choice and Autonomy,Book Selection Skills,,Examples: Choosing Books Based on Interests — The ability to select books that align with personal interests and preferences.; Evaluating Book Difficulty — The skill of assessing the complexity of books to choose appropriate reading materials.; Using Book Recommendation Tools and Platforms — The ability to use digital tools and platforms to discover book recommendations tailored to individual tastes.
Active Self-Regulation,Motivation and Engagement,Reading Interest-based Choice,Reader's Choice and Autonomy,Making Informed Choices,,Examples: Exploring New Genres and Authors — The ability to venture into new literary genres and discover works by different authors to diversify the reading experience.; Making Independent Reading Choices — The skill of selecting books independently based on personal criteria and preferences.; Reflecting on Reading Preferences — The practice of analyzing and understanding one's reading preferences to make informed choices and use these insights to guide future book selections.
Active Self-Regulation,Motivation and Engagement,Reading Interest-based Choice,Reader's Choice and Autonomy,Managing Personal Reading Library,,"Examples: Cataloging Books — The practice of keeping a detailed record of books in a personal library, including read and unread titles, and adding notes or summaries.; Organizing a Personal Library — The skill of arranging and maintaining a personal collection of books for easy access and retrieval."
Active Self-Regulation,Strategy Use,Decoding Unknown Words,Decoding Challenges,Morphological Analysis,,Examples: Analyzing Word Roots — Understanding the meaning of words through their roots.; Using Prefixes and Suffixes — Applying knowledge of prefixes and suffixes to decode unfamiliar words.
Active Self-Regulation,Strategy Use,Decoding Unknown Words,Decoding Challenges,Phonics Application,,Examples: Recognizing Phonemic Patterns — The practice of identifying common phonemic patterns in words to aid in decoding.; Sounding Out Words — Using phonetic knowledge to decode unfamiliar words.
Active Self-Regulation,Strategy Use,Decoding Unknown Words,Decoding Strategies,Sound Recognition,,Examples: Applying Phonetic Rules — Using phonetic rules to sound out and understand unfamiliar words.; Recognizing Common Sounds — The ability to identify and understand common sounds in words to facilitate decoding.
Active Self-Regulation,Strategy Use,Decoding Unknown Words,Decoding Strategies,Structural Analysis,,Examples: Breaking Down Complex Words — The practice of dividing complex words into smaller components to understand their meaning.; Understanding Affixes and Roots — The ability to decode words by understanding the role of affixes and roots in their structure.
Active Self-Regulation,Strategy Use,Digital Reading Strategies,Accessibility Features,Assistive Technologies,,Examples: Use Text-to-Speech and Screen Readers — The ability to use text-to-speech and screen-reader features strategically to support comprehension.; Use TTS at Comprehension Rate — The ability to set TTS pace that preserves comprehension.; Use Screen Reader Navigation Shortcuts — The ability to navigate efficiently with screen‑reader shortcuts.
Active Self-Regulation,Strategy Use,Digital Reading Strategies,Accessibility Features,Readability Settings,,"Examples: Adjust Font, Spacing, and Contrast — The ability to adjust font, spacing, and contrast to improve readability and reduce visual strain.; Customize Font Type/Size — The ability to choose readable font type/size for endurance.; Adjust Contrast/Theme — The ability to select contrast and theme (light/dark) for comfort."
Active Self-Regulation,Strategy Use,Digital Reading Strategies,Annotation and Bookmarking,Highlighting and Notes,,"Examples: Highlighting and Notes — The ability to highlight key text and add margin notes efficiently in digital readers.; Use Color‑Coding Scheme — The ability to color‑code highlights by function (key idea, evidence, question).; Summarize Highlights into Notes — The ability to convert highlights into concise notes after reading."
Active Self-Regulation,Strategy Use,Digital Reading Strategies,Annotation and Bookmarking,Managing Bookmarks,,"Examples: Managing Bookmarks — The ability to create, organize, and retrieve bookmarks to support navigation and study.; Tag Bookmarks by Topic — The ability to tag bookmarks with topical labels for retrieval.; Organize Bookmarks into Folders — The ability to organize bookmarks into folders/collections."
