Strand,Pillar,Domain,Skill Area,Skill Set,Skill Subset,Skill Subset Annotation
Language Comprehension,Background Knowledge,Academic Content Knowledge,Science Knowledge,Understanding Major Scientific Discoveries,Understanding Historical Scientific Breakthroughs,Knowledge of significant scientific discoveries and their impact
Language Comprehension,Background Knowledge,Academic Content Knowledge,Mathematics Knowledge,Understanding Basic Mathematical Concepts,Understanding Number Systems,Knowledge of fundamental mathematical concepts and operations
Language Comprehension,Background Knowledge,Academic Content Knowledge,Mathematics Knowledge,Understanding Mathematical Terms,Understanding Mathematical Vocabulary,Knowledge of essential mathematical terminology and symbols
Language Comprehension,Background Knowledge,Academic Content Knowledge,Historical Knowledge,Understanding Major Historical Events,Understanding World History,Knowledge of significant historical events and their contexts
Language Comprehension,Background Knowledge,Academic Content Knowledge,Historical Knowledge,Understanding Historical Figures,Understanding Influential Historical Figures,Knowledge of important historical figures and their contributions
Language Comprehension,Background Knowledge,Academic Content Knowledge,Historical Knowledge,Understanding Historical Timelines,Understanding Chronological Relationships,Knowledge of historical sequence and cause-effect relationships
Language Comprehension,Background Knowledge,Academic Content Knowledge,Geographic Knowledge,Understanding Geographical Features,Understanding Physical Geography,"Knowledge of landforms, climate, and natural features"
Language Comprehension,Background Knowledge,Academic Content Knowledge,Geographic Knowledge,Understanding Continents and Oceans,Understanding World Geography,Knowledge of major geographical divisions and features
Language Comprehension,Background Knowledge,General World Knowledge,Cultural Knowledge,Understanding Cultural Practices,Understanding Global Cultural Practices,Knowledge of cultural traditions and practices across different societies
Language Comprehension,Background Knowledge,General World Knowledge,Cultural Knowledge,Understanding Cultural Symbols,Understanding Cultural Symbolism,Knowledge of symbols and their meanings within different cultures
Language Comprehension,Background Knowledge,General World Knowledge,Practical Knowledge,Financial Literacy,Understanding Basic Financial Concepts,Knowledge of fundamental financial principles and practices
Language Comprehension,Background Knowledge,General World Knowledge,Practical Knowledge,Health Literacy,Understanding Basic Health Concepts,Knowledge of fundamental health and wellness principles
Language Comprehension,Background Knowledge,General World Knowledge,Social and Emotional Literacy,Self-awareness,Understanding Personal Emotions,The ability to recognize and understand one's own emotions and their effects
Language Comprehension,Background Knowledge,General World Knowledge,Social and Emotional Literacy,Social-awareness,Understanding Others' Emotions,The ability to recognize and understand others' emotions and perspectives
Language Comprehension,Background Knowledge,21st-Century Knowledge,Environmental Literacy,Environmental Issues,Understanding Climate Change,Knowledge of climate change causes and effects
Language Comprehension,Background Knowledge,21st-Century Knowledge,Environmental Literacy,Environmental Issues,Understanding Pollution,Knowledge of different types of pollution and their impact
Language Comprehension,Background Knowledge,21st-Century Knowledge,Environmental Literacy,Understanding Ecosystems,Understanding Biodiversity,Knowledge of ecosystem diversity and interdependence
Language Comprehension,Background Knowledge,21st-Century Knowledge,Environmental Literacy,Sustainable Practices,Understanding Conservation,Knowledge of environmental conservation practices
Language Comprehension,Background Knowledge,21st-Century Knowledge,Environmental Literacy,Advocacy and Action,Environmental Problem-Solving,The ability to develop solutions for environmental challenges
Language Comprehension,Background Knowledge,Academic Content Knowledge,Cross-disciplinary Knowledge,Understanding Interdisciplinary Connections,Understanding STEM Integration,Knowledge of how science technology engineering and mathematics connect
Language Comprehension,Background Knowledge,Academic Content Knowledge,Cross-disciplinary Knowledge,Understanding Interdisciplinary Humanities,Understanding Humanities Integration,Knowledge of how history literature arts and social sciences connect
Language Comprehension,Background Knowledge,Academic Content Knowledge,Geographic Knowledge,Understanding Climate Zones,Understanding Global Climate Patterns,Knowledge of different climate zones and their characteristics
Language Comprehension,Background Knowledge,Academic Content Knowledge,Geographic Knowledge,Understanding and Interpreting Maps,Understanding Cartographic Skills,Knowledge of map reading and interpretation skills
Language Comprehension,Background Knowledge,Academic Content Knowledge,Historical Knowledge,Understanding Cause and Effect in History,Understanding Historical Causation,Knowledge of how historical events influence subsequent developments
Language Comprehension,Background Knowledge,Academic Content Knowledge,Historical Knowledge,Understanding Major Socio-Political Movements,Understanding Social Movements,Knowledge of major social and political movements throughout history
Language Comprehension,Background Knowledge,Academic Content Knowledge,Mathematics Knowledge,Understanding Historical Mathematical Developments,Understanding Mathematical History,Knowledge of the development of mathematical concepts over time
Language Comprehension,Background Knowledge,Academic Content Knowledge,Science Knowledge,Understanding Data From Experiments,Understanding Scientific Data Analysis,Knowledge of how to interpret experimental data and results
Language Comprehension,Background Knowledge,Academic Content Knowledge,Science Knowledge,Understanding Environmental Science Concepts,Understanding Environmental Science,Knowledge of environmental science principles and concepts
Language Comprehension,Background Knowledge,Academic Content Knowledge,Science Knowledge,Understanding Historical Science Figures,Understanding Scientific History,Knowledge of important scientists and their contributions
Language Comprehension,Background Knowledge,Academic Content Knowledge,Science Knowledge,Understanding Scientific Methodologies,Understanding Research Methods,Knowledge of scientific research methods and processes
Language Comprehension,Background Knowledge,General World Knowledge,Cultural Knowledge,Understanding Cultural Artefacts and Symbols,Understanding Cultural Symbols,Knowledge of symbols and artifacts across cultures
Language Comprehension,Background Knowledge,General World Knowledge,Cultural Knowledge,Understanding Current Local And Global Events,Understanding Current Events,Knowledge of contemporary local and global developments
Language Comprehension,Background Knowledge,General World Knowledge,Cultural Knowledge,Understanding Influential Cultural Figures,Understanding Cultural Leaders,Knowledge of important cultural and intellectual figures
Language Comprehension,Background Knowledge,General World Knowledge,Cultural Knowledge,Understanding Languages,Understanding Linguistic Diversity,Knowledge of language families and linguistic diversity
Language Comprehension,Background Knowledge,General World Knowledge,Cultural Knowledge,Understanding Traditions,Understanding Cultural Traditions,Knowledge of traditional practices across cultures
Language Comprehension,Background Knowledge,General World Knowledge,Personal and Experiential Knowledge,Understanding Intercultural Interactions,Understanding Cross-Cultural Communication,Knowledge of effective intercultural communication
Language Comprehension,Background Knowledge,General World Knowledge,Personal and Experiential Knowledge,Understanding Personal Challenges,Understanding Personal Growth,Knowledge of personal development and challenge resolution
Language Comprehension,Background Knowledge,General World Knowledge,Personal and Experiential Knowledge,Understanding Personal Relationships,Understanding Relationship Dynamics,Knowledge of healthy relationship patterns and communication
Language Comprehension,Background Knowledge,General World Knowledge,Practical Knowledge,Basic Legal Literacy,Understanding Legal Concepts,Knowledge of basic legal principles and rights
Language Comprehension,Background Knowledge,General World Knowledge,Practical Knowledge,Emergency Preparedness,Understanding Safety Procedures,Knowledge of emergency response and safety protocols
Language Comprehension,Background Knowledge,General World Knowledge,Practical Knowledge,Numeracy,Understanding Quantitative Reasoning,Knowledge of basic mathematical reasoning in daily life
Language Comprehension,Background Knowledge,General World Knowledge,Social and Emotional Literacy,Relationship Skills,Understanding Social Interaction,Knowledge of effective social interaction and relationship building
Language Comprehension,Background Knowledge,General World Knowledge,Social and Emotional Literacy,Responsible Decision-making,Understanding Ethical Decision-Making,Knowledge of ethical reasoning and responsible choice-making
Language Comprehension,Background Knowledge,General World Knowledge,Social and Emotional Literacy,Self-management,Understanding Self-Regulation,Knowledge of emotional and behavioral self-regulation strategies
Language Comprehension,Background Knowledge,General World Knowledge,Societal Knowledge,Understanding Community Practices,Understanding Civic Engagement,Knowledge of community participation and civic responsibility
Language Comprehension,Background Knowledge,General World Knowledge,Societal Knowledge,Understanding Social Structures,Understanding Social Organization,Knowledge of how societies organize and function
Language Comprehension,Comprehension,Comprehension Monitoring,Monitoring and Repair,Detecting Breakdowns,Detecting Comprehension Breakdowns,The ability to recognize loss of understanding during reading and indicate a need for repair.
Language Comprehension,Comprehension,Comprehension Monitoring,Monitoring and Repair,Restoring Understanding,Restoring Understanding,The ability to restore understanding by rereading or consulting supports (strategy routines are defined elsewhere).
Language Comprehension,Comprehension,Levels of Understanding,Evaluative Understanding,Evaluating Claims and Quality,Evaluating Claims and Quality,"The ability to critique ideas, arguments, and textual quality using evidence and reasoning."
Language Comprehension,Comprehension,Levels of Understanding,Inferential Understanding,Drawing Inferences,Drawing Inferences,The ability to integrate textual evidence with background knowledge to infer unstated meanings.
Language Comprehension,Comprehension,Levels of Understanding,Literal Understanding,Identifying Explicit Information,Identifying Explicit Information,The ability to retrieve and paraphrase explicitly stated information in text.
Language Comprehension,Comprehension,Comprehension Strategies,Before Reading,Activating Prior Knowledge,Connecting to Background Knowledge,The ability to activate relevant background knowledge before reading to support comprehension.
Language Comprehension,Comprehension,Comprehension Strategies,Before Reading,Previewing Text,Scanning Text Structure and Features,"The ability to preview text structure, headings, and features to prepare for reading."
Language Comprehension,Comprehension,Comprehension Strategies,During Reading,Monitoring Understanding,Self-Monitoring Comprehension,The ability to monitor one's understanding while reading and recognize when comprehension breaks down.
Language Comprehension,Comprehension,Comprehension Strategies,During Reading,Making Connections,Connecting Ideas Within and Across Texts,The ability to make connections between ideas within a text and across different texts.
Language Comprehension,Comprehension,Comprehension Strategies,After Reading,Summarizing,Creating Text Summaries,The ability to summarize main ideas and key details after reading.
Language Comprehension,Comprehension,Comprehension Strategies,After Reading,Reflecting,Reflecting on Text Meaning and Personal Response,The ability to reflect on text meaning and personal responses to enhance understanding.
Language Comprehension,Language Structure,Morphological Structures,Case Systems,Pronoun Cases,Objective Case,"The ability to recognize and understand objective case pronouns, such as 'me,' 'you,' 'him,' 'her,' 'it,' 'us,' 'them.'"
Language Comprehension,Language Structure,Morphological Structures,Case Systems,Pronoun Cases,Possessive Case,"The ability to recognize and understand possessive case pronouns, such as 'my/mine,' 'your/yours,' 'his,' 'her/hers,' 'its,' 'our/ours,' 'their/theirs.'"
Language Comprehension,Language Structure,Morphological Structures,Case Systems,Pronoun Cases,Subjective Case,"The ability to recognize and understand subjective case pronouns, such as 'I,' 'you,' 'he,' 'she,' 'it,' 'we,' 'they.'"
Language Comprehension,Language Structure,Morphological Structures,Inflectional Patterns,Noun Inflections,Irregular Plural Formation,"The ability to recognize irregular plural forms, such as 'children,' 'mice,' 'feet.'"
Language Comprehension,Language Structure,Morphological Structures,Inflectional Patterns,Noun Inflections,Regular Plural Formation,"The ability to recognize regular plural patterns, such as adding -s or -es to nouns."
Language Comprehension,Language Structure,Morphological Structures,Inflectional Patterns,Verb Inflections,Irregular Past Tense Formation,"The ability to recognize irregular past tense forms, such as 'went,' 'sang,' 'brought.'"
Language Comprehension,Language Structure,Morphological Structures,Inflectional Patterns,Verb Inflections,Regular Past Tense Formation,"The ability to recognize regular past tense formation with -ed, such as 'walked,' 'played.'"
Language Comprehension,Language Structure,Morphological Structures,Possessive Forms,Noun Possessives,Plural Possessive Nouns,"The ability to recognize and use plural possessive forms, such as 'the cats' toys,' 'the children's books.'"
Language Comprehension,Language Structure,Morphological Structures,Possessive Forms,Noun Possessives,Singular Possessive Nouns,"The ability to recognize and use singular possessive forms, such as 'the cat's toy,' 'James's book.'"
Language Comprehension,Language Structure,Morphological Structures,Possessive Forms,Pronoun Possessives,Possessive Determiners,"The ability to recognize and use possessive determiners, such as 'my,' 'your,' 'his,' 'her,' 'its,' 'our,' 'their.'"
Language Comprehension,Language Structure,Morphological Structures,Possessive Forms,Pronoun Possessives,Possessive Pronouns,"The ability to recognize and use possessive pronouns, such as 'mine,' 'yours,' 'his,' 'hers,' 'its,' 'ours,' 'theirs.'"
Language Comprehension,Language Structure,Parts of Speech,Adjectives,Functions of Adjectives,Applying Adjectives in Sentences,The skill of using adjectives correctly to modify nouns within sentences. For example: 'The red car is fast' or 'She wore a beautiful dress.'
Language Comprehension,Language Structure,Parts of Speech,Adjectives,Functions of Adjectives,Combining Adjectives with Nouns,The ability to correctly pair adjectives with nouns to provide detailed descriptions. For example: 'The angry dog' or 'The large elephant.'
Language Comprehension,Language Structure,Parts of Speech,Adjectives,Understanding Adjectives,Recognizing Demonstrative Adjectives,"The ability to identify adjectives that point out specific nouns. For example: 'This book,' 'Those cars.'"
Language Comprehension,Language Structure,Parts of Speech,Adjectives,Understanding Adjectives,Recognizing Descriptive Adjectives,"The skill of identifying adjectives that describe qualities or characteristics of nouns. For example: 'happy child,' 'blue sky.'"
Language Comprehension,Language Structure,Parts of Speech,Adjectives,Understanding Adjectives,Recognizing Quantitative Adjectives,"The ability to identify adjectives that indicate quantity or number. For example: 'three apples,' 'many books.'"
Language Comprehension,Language Structure,Parts of Speech,Adverbs,Functions of Adverbs,Applying Adverbs in Sentences,"The ability to use adverbs correctly to modify verbs, adjectives, or other adverbs within sentences. For example: 'She sings beautifully' or 'He runs quickly.'"
Language Comprehension,Language Structure,Parts of Speech,Adverbs,Functions of Adverbs,Combining Adverbs with Verbs,The skill of pairing adverbs appropriately with verbs to provide detailed information about actions. For example: 'He speaks quietly' or 'They work diligently.'
Language Comprehension,Language Structure,Parts of Speech,Adverbs,Understanding Adverbs,Recognizing Adverbs of Degree,"The skill of identifying adverbs that indicate the intensity or degree of an action or adjective. For example: 'very happy,' 'quite difficult.'"
Language Comprehension,Language Structure,Parts of Speech,Adverbs,Understanding Adverbs,Recognizing Adverbs of Frequency,"The ability to identify adverbs that describe how often an action occurs. For example: 'always,' 'never,' 'often.'"
Language Comprehension,Language Structure,Parts of Speech,Adverbs,Understanding Adverbs,Recognizing Adverbs of Manner,"The ability to identify adverbs that describe the manner in which an action is performed, like 'quickly,' 'slowly,' 'neatly.'"
Language Comprehension,Language Structure,Parts of Speech,Agreement and Usage,Pronoun-Antecedent Agreement,Number and Gender Agreement,"The ability to ensure pronouns agree with their antecedents in number and gender, such as 'Each student should bring his or her book.'"
Language Comprehension,Language Structure,Parts of Speech,Agreement and Usage,Subject-Verb Agreement,Number Agreement,"The ability to recognize and apply agreement between singular subjects and singular verbs, plural subjects and plural verbs, such as 'The dog runs' vs. 'The dogs run.'"
Language Comprehension,Language Structure,Parts of Speech,Agreement and Usage,Subject-Verb Agreement,Person Agreement,"The ability to recognize and apply agreement between subjects and verbs based on person, such as 'I am,' 'you are,' 'he is.'"
Language Comprehension,Language Structure,Parts of Speech,Conjunction Categories,Coordinating Conjunctions,Identifying Coordinating Conjunctions,"The ability to recognize coordinating conjunctions that join equal elements, such as 'and,' 'but,' 'or,' 'nor,' 'for,' 'yet,' 'so.'"
Language Comprehension,Language Structure,Parts of Speech,Conjunction Categories,Correlative Conjunctions,Identifying Correlative Conjunctions,"The ability to recognize paired conjunctions that work together, such as 'either...or,' 'neither...nor,' 'both...and,' 'not only...but also.'"
Language Comprehension,Language Structure,Parts of Speech,Conjunction Categories,Subordinating Conjunctions,Identifying Subordinating Conjunctions,"The ability to recognize subordinating conjunctions that introduce dependent clauses, such as 'because,' 'although,' 'when,' 'if,' 'since.'"
Language Comprehension,Language Structure,Parts of Speech,Determiner Categories,Articles,Definite Articles,The ability to recognize and understand the definite article 'the' and its function in specifying particular nouns.
Language Comprehension,Language Structure,Parts of Speech,Determiner Categories,Articles,Indefinite Articles,The ability to recognize and understand indefinite articles 'a' and 'an' and their function in referring to non-specific nouns.
Language Comprehension,Language Structure,Parts of Speech,Determiner Categories,Demonstratives,Demonstrative Determiners,"The ability to recognize and understand demonstrative determiners such as 'this,' 'that,' 'these,' 'those.'"
Language Comprehension,Language Structure,Parts of Speech,Determiner Categories,Quantifiers,Quantifying Determiners,"The ability to recognize and understand quantifying determiners such as 'some,' 'many,' 'few,' 'all,' 'each.'"
Language Comprehension,Language Structure,Parts of Speech,Interjections,Interjection Usage,Expressing Emotions Using Interjections,"The ability to use interjections effectively to express various emotions. For example: 'Yay, we won!' (joy) or 'Ouch, that hurt!' (pain)"
Language Comprehension,Language Structure,Parts of Speech,Interjections,Interjection Usage,Using Interjections in Sentences,The skill of incorporating interjections appropriately within sentences to convey strong emotion. For example: 'Oh no! I forgot my keys!' or 'Wow! That was amazing.'
Language Comprehension,Language Structure,Parts of Speech,Interjections,Types of Interjections,Recognizing Emotive Interjections,"The skill of identifying interjections that reflect the speaker's emotional state. For example: 'Ah!,' 'Ugh!,' 'Phew!'"
Language Comprehension,Language Structure,Parts of Speech,Interjections,Types of Interjections,Recognizing Exclamatory Interjections,"The skill of identifying interjections that express sudden or strong emotions. For example: 'Hey!,' 'Wow!,' 'Oops!'"
Language Comprehension,Language Structure,Parts of Speech,Interjections,Understanding Interjections,Recognizing Interjections,"The ability to recognize words or phrases used as interjections within sentences, like 'Ah,' 'Oh dear,' 'Bravo!'"
Language Comprehension,Language Structure,Parts of Speech,Nouns,Functions of Nouns,Combining Nouns with Adjectives,"The skill of correctly pairing nouns with adjectives to provide descriptive detail. For example: 'The tall tree,' 'An interesting book.'"
Language Comprehension,Language Structure,Parts of Speech,Nouns,Functions of Nouns,Recognizing Functions in Sentences,"The ability to determine the grammatical function of nouns within sentences (e.g., subject, object, complement). For example: 'John is a teacher.' (subject), 'She gave John a book.' (indirect object)"
Language Comprehension,Language Structure,Parts of Speech,Nouns,Understanding Nouns,Recognizing Abstract Nouns,"The ability to identify nouns that refer to concepts, ideas, or qualities rather than physical objects. For example: 'freedom,' 'happiness,' 'strength.'"
Language Comprehension,Language Structure,Parts of Speech,Nouns,Understanding Nouns,Recognizing Common Nouns,"The skill of identifying general, nonspecific nouns. For example: 'city,' 'day,' 'man.'"
Language Comprehension,Language Structure,Parts of Speech,Nouns,Understanding Nouns,Recognizing Proper Nouns,"The ability to identify nouns that name specific people, places, or things. For example: 'Paris,' 'Monday,' 'Mr. Smith.'"
Language Comprehension,Language Structure,Parts of Speech,Prepositions,Functions of Prepositions,Applying Correct Usage of Prepositions,"The ability to use prepositions accurately to show relationships between nouns and other words. For example: 'The book is on the table,' 'They arrived after dinner.'"
Language Comprehension,Language Structure,Parts of Speech,Prepositions,Functions of Prepositions,Combining Prepositions with Nouns,"The skill of pairing prepositions correctly with nouns to form prepositional phrases. For example: 'in the car,' 'under the bed.'"
Language Comprehension,Language Structure,Parts of Speech,Prepositions,Understanding Prepositions,Recognizing Prepositions of Place,"The ability to identify prepositions that indicate location (e.g., at, on, in). For example: 'at,' 'on,' 'in.'"
Language Comprehension,Language Structure,Parts of Speech,Prepositions,Understanding Prepositions,Recognizing Prepositions of Time,"The skill of identifying prepositions that indicate time (e.g., before, after, during). For example: 'before,' 'after,' 'during.'"
Language Comprehension,Language Structure,Parts of Speech,Pronouns,Functions of Pronouns,Combining Pronouns with Verbs,"The ability to correctly pair pronouns with verbs to form complete sentences. For example: 'He runs,' 'They play,' 'She sings.'"
Language Comprehension,Language Structure,Parts of Speech,Pronouns,Functions of Pronouns,Recognizing Functions in Sentences,"The skill of recognizing the roles pronouns play within sentences (e.g., subject, object). For example: 'I saw her.' ('her' as object) or 'She is talking.' ('She' as subject)"
Language Comprehension,Language Structure,Parts of Speech,Pronouns,Understanding Pronouns,Recognizing Personal Pronouns,"The ability to identify pronouns that refer to specific people or things. For example: 'I,' 'you,' 'he,' 'she,' 'it,' 'we,' 'they.'"
Language Comprehension,Language Structure,Parts of Speech,Recognition and Function,Recognizing and Applying Parts of Speech,Recognizing and Applying Parts of Speech,"The ability to recognize and apply functions of key parts of speech (nouns, verbs, adjectives, adverbs, pronouns, prepositions, conjunctions, interjections) in context."
Language Comprehension,Language Structure,Parts of Speech,Verb Categories,Action vs. Linking Verbs,Distinguishing Action from Linking Verbs,"The ability to differentiate between action and linking verbs in context, such as recognizing 'feels' as linking in 'She feels happy' vs. action in 'She feels the fabric.'"
Language Comprehension,Language Structure,Parts of Speech,Verb Categories,Action vs. Linking Verbs,Identifying Action Verbs,"The ability to recognize verbs that express action or activity, such as 'run,' 'write,' 'think.'"
Language Comprehension,Language Structure,Parts of Speech,Verb Categories,Action vs. Linking Verbs,Identifying Linking Verbs,"The ability to recognize verbs that connect the subject to additional information, such as 'be,' 'seem,' 'become.'"
